text_id	sequence_number	word_id	phonetic_transcription	word_form	morphs	gloss	session_id	session_name	sequence_number_text	start_time	end_time	person_id	person_code	text	phonetic_transcription_text	morphs_text	gloss_text	english_translation_text	indonesian_translation	comments	data_set_id	data_set_name	date	location	region	latitude	longitude	genre	subgenre	mode	elicited_or_natural	situation	duration	record_count	word_count	classification	project_id	project_name	description	session_count	primary_or_secondary	n_languoid_id	n_languoid_name	languoid_name_new
139900104901270400	10	10040410312745654e7	snaŋ	senang	senang	happy	1351	MLP-070308-FIT	332	0:13:41	NA	973	FTRMLP	oh iyo sudah baru ko crita ka ko paling senang tu bikin apa	o iyo suda baru ko critra ka ko paliŋ snaŋ tu bikin apa	oh iyo sudah baru ko crita ka ko paling senang tu bikin apa	oh yes PFCT new 2SG story KA 2SG most happy that make what	oh...tell me what do you really like to do?	NA	NA	14	Papuan Malay	2007-03-08	Papua	Papua	NA	NA	NA	NA	Spoken	Natural	the small talk occurs in a state elementary school of Amban	0:18:16	400	2227	Eastern Varieties of Indonesian (Kupang Malay, Ternate Malay, Papua Malay)	24	Papuan Malay	A corpus of naturalistic speech from Papuan Malay.	9	Primary	1	1	Papuan Malay
992625105341050400	8	10040410312745654e7	senaŋ	senang	senang	happy	1347	MLP-070211-NAN	446	0:22:49	NA	2806	SRMLP	pokoknya pelajaran apa saja itu kalo ana-ana senang ikut baru ikut.	pokoɲap pelajaran apa saja itu kalo anana senaŋ ikut baru ikut	pokok -nya pelajar -an apa saja i- tu kalo ana ~ ana senang ikut baru ikut	main -NYA student -AN what just I- that TOP child ~ child happy follow new follow	whatever the lesson, if we like it, we will attend the class	NA	NA	14	Papuan Malay	2007-02-11	Papua	Papua	NA	NA	NA	NA	Spoken	Natural	small talk in class room	0:41:15	751	4938	Eastern Varieties of Indonesian (Kupang Malay, Ternate Malay, Papua Malay)	24	Papuan Malay	A corpus of naturalistic speech from Papuan Malay.	9	Primary	1	1	Papuan Malay
437010215649110500	6	10040409454888868e7	giraŋ	girang	girang	happy	2449	TNG-050802	549	0:11:24	NA	2447	RISTNG	kasi... kasi peqgo juga dia girang banget.	kasiʰ kasi pɛʔgo juga dya giraŋ baŋət	kasi kasi peqgo juga dia girang banget	give give one.hundred.fifty also 3 happy very	give... just give him a hundred fifty, and he would be very happy.	NA	=a hundred and fifty thousand rupiahs. recheck the gloss.	62	Cina Benteng Malay	2002-08-05	Tangerang	Banten	NA	NA	NA	NA	Spoken	Natural	"1. talking at MAR’s living room. 2. First, they’re talking about farming. 3. Then, they’re talking about fishing. 3. After that they’re talking about poultry breeding. 4. Moreover, they’re also talking about other things such as humors, the ""basò alus"" or the ""basò kulò nggé"" used by children talking to adults, ""pantun"", a kind of traditional poetry and Mariana’s family."	0:11:30	570	2250	Other Western Varieties of Indonesian (Bandung, Tanggerang Chinese Malay, Padang)	18	Malayic Languages of Java	NA	3	Primary	1	1	Tangerang Chinese Malay
366002101303290300	5	1004040945254441e8	gembira	gembira	gembira	happy	2033	PDG-20070131-SAN	1154	0:45:05	NA	1328	JULSAN	ya ado lah raso gembira nyo kan.	ya ʔado lah raso gembira ɲo kan	ya ado lah raso gembira nyo kan	yes exist LAH feel happy 3 KAN	NA	ada rasa gembiranya.	NA	48	Minangkabau	2007-01-31	Padang	West Sumatra	-0.955445	100.357958	Conversation	NA	Spoken	Natural	percakapan terjadi di rumah membicarakan tentang kehidupan Rajiah.	0:45:48	1174	6661	Minangkabau (various dialects)	19	Malayic Languages of Sumatra	NA	175	Primary	1	1	Minangkabau, Maninjau
615574115812200600	2	10040409454888868e7	giraŋ	girang	girang	happy	1539	BTW-010307	2696	1:03:15	NA	991	GENBTW	saya girang banget ini xx... didatengin jugaq.	sa giraŋ baːŋət ʔini dit̩m didatəŋin jugaːʔ	saya girang banget ini xx di- dateng -in juga	1SG happy very this xx DI- come -IN also	I’m so happy... that xx... you visit me.	NA	NA	19	Jakarta	2007-03-01	Jakarta	Jakarta	-6.209199	106.833797	NA	NA	Spoken	Natural	visiting Geno's house, chatting with some of Geno's family members in front of her house. Geno's talking about her experience when making a pilgrimage trip to Mecca, Roji' talking about Betawi language and the village where they're living, Setu Babakan, and Seli's talking about his job.	1:03:35	2720	9630	Jakarta Indonesian	9	Jakarta Indonesian	Betawi is the indigenous Malay dialect of Jakarta. The speakers were formed from the mixing of ethnicities coming to Jakarta during Dutch colonial times. The inflows were adequately gradual to let the constant stream of immigrants be absorbed into a distinct ethnic group. This ethnic group speaks with their own dialect called Betawi Malay which is different from other dialects of Malay. Nowadays it is only spoken by older people in certain villages on the outskirts of the city. The younger generation tends to speak Jakarta Indonesian.  The project was started in June 2004. There have been twelve recordings which are collected randomly from the speakers who live or have lived in some regions in Jakarta. The regions are Kampung Melayu, Pasar Rebo, Pondok Gede, Ulujami, and Jagakarsa. Most of the regions, except Kampung Melayu, are situated on the outskirts of Jakarta. Pasar Rebo is situated at the very southeast edge of Jakarta, bordering Bogor, West Java. Pondok Gede is also situated at the very southeast edge of Jakarta, bordering Bekasi and Bogor, West Java. Ulujami is situated in South Jakarta, bordering Banten, West Java and Jagakarsa is situated in South Jakarta, bordering Depok, West Java. There are around fifteen native speakers from the total recordings, the speakers are above thirty years old. They still speak with a deep Betawi accent. The rest of the speakers are from younger generation and other ethnicities. For future plan, more recordings will be done with the native speakers from other areas of Jakarta.	48	Primary	1	1	Jakarta Indonesian
196253084824301e3	6	10040409454888868e7	giraŋ	girang	girang	happy	1534	BTJ-240607	856	0:28:03	NA	435	BTJBET	énak déh tuq punyaq tana, girang.	ʔenak de tuʔ puɲaʔ tana giraŋ	énak déh tu punya tana girang	pleasant DEH that have soil happy	I was so happy to have land.	NA	NA	19	Jakarta	2007-06-24	Jakarta	Jakarta	-6.209199	106.833797	Conversation	NA	Spoken	Natural	chatting at BTJBET's house	0:34:30	1076	3990	Jakarta Indonesian	9	Jakarta Indonesian	Betawi is the indigenous Malay dialect of Jakarta. The speakers were formed from the mixing of ethnicities coming to Jakarta during Dutch colonial times. The inflows were adequately gradual to let the constant stream of immigrants be absorbed into a distinct ethnic group. This ethnic group speaks with their own dialect called Betawi Malay which is different from other dialects of Malay. Nowadays it is only spoken by older people in certain villages on the outskirts of the city. The younger generation tends to speak Jakarta Indonesian.  The project was started in June 2004. There have been twelve recordings which are collected randomly from the speakers who live or have lived in some regions in Jakarta. The regions are Kampung Melayu, Pasar Rebo, Pondok Gede, Ulujami, and Jagakarsa. Most of the regions, except Kampung Melayu, are situated on the outskirts of Jakarta. Pasar Rebo is situated at the very southeast edge of Jakarta, bordering Bogor, West Java. Pondok Gede is also situated at the very southeast edge of Jakarta, bordering Bekasi and Bogor, West Java. Ulujami is situated in South Jakarta, bordering Banten, West Java and Jagakarsa is situated in South Jakarta, bordering Depok, West Java. There are around fifteen native speakers from the total recordings, the speakers are above thirty years old. They still speak with a deep Betawi accent. The rest of the speakers are from younger generation and other ethnicities. For future plan, more recordings will be done with the native speakers from other areas of Jakarta.	48	Primary	1	1	Jakarta Indonesian
830690144011140700	4	10040409454888868e7	giraŋ	girang	girang	happy	1542	BTW-040606	1135	0:26:22	NA	270	ASNBTW	ngga, ngga pa-pa, girang saya, biar tauq kemari.	ŋkaːʔ ŋga papah giraŋ sayah biyar tau kəmariːʰ	ngga ngga pa ~ pa girang saya biar tau ke- mari	NEG NEG what ~ what happy 1SG let know KE- MARI	no, it’s okay, I’m so happy, so that you know this place.	NA	NA	19	Jakarta	2006-06-04	Jakarta	Jakarta	-6.209199	106.833797	NA	NA	Spoken	Natural	EXPOKK and DEWBTW are visiting ASNBTW's house, happened in the afternoon.	0:27:09	1186	4722	Jakarta Indonesian	9	Jakarta Indonesian	Betawi is the indigenous Malay dialect of Jakarta. The speakers were formed from the mixing of ethnicities coming to Jakarta during Dutch colonial times. The inflows were adequately gradual to let the constant stream of immigrants be absorbed into a distinct ethnic group. This ethnic group speaks with their own dialect called Betawi Malay which is different from other dialects of Malay. Nowadays it is only spoken by older people in certain villages on the outskirts of the city. The younger generation tends to speak Jakarta Indonesian.  The project was started in June 2004. There have been twelve recordings which are collected randomly from the speakers who live or have lived in some regions in Jakarta. The regions are Kampung Melayu, Pasar Rebo, Pondok Gede, Ulujami, and Jagakarsa. Most of the regions, except Kampung Melayu, are situated on the outskirts of Jakarta. Pasar Rebo is situated at the very southeast edge of Jakarta, bordering Bogor, West Java. Pondok Gede is also situated at the very southeast edge of Jakarta, bordering Bekasi and Bogor, West Java. Ulujami is situated in South Jakarta, bordering Banten, West Java and Jagakarsa is situated in South Jakarta, bordering Depok, West Java. There are around fifteen native speakers from the total recordings, the speakers are above thirty years old. They still speak with a deep Betawi accent. The rest of the speakers are from younger generation and other ethnicities. For future plan, more recordings will be done with the native speakers from other areas of Jakarta.	48	Primary	1	1	Jakarta Indonesian
553551103911220740	6	10040409454888868e7	giraŋ	girang	girang	happy	1547	BTW-230604	239	0:08:10	NA	3055	UDIBTW	tujuh belasan dulu ngarak ondél-ondél, girang bangat.	tuju bəlasan duluʔ ŋarak ʔɔndɛlʔɔndɛl giraŋ baŋat	tujuh belas -an dulu ng- arak ondél.ondél girang bangat	seven teen -AN before N- procession giant.puppet happy very	we were carrying giant puppet in the parade on the seventeeth, we were so happy.	NA	referring to the celebration of Indonesian independence day on seventeenth of August.	19	Jakarta	2004-06-23	Jakarta	Jakarta	-6.209199	106.833797	NA	NA	Spoken	Natural	sitting in UDIBTW's living room.	0:19:05	523	2736	Jakarta Indonesian	9	Jakarta Indonesian	Betawi is the indigenous Malay dialect of Jakarta. The speakers were formed from the mixing of ethnicities coming to Jakarta during Dutch colonial times. The inflows were adequately gradual to let the constant stream of immigrants be absorbed into a distinct ethnic group. This ethnic group speaks with their own dialect called Betawi Malay which is different from other dialects of Malay. Nowadays it is only spoken by older people in certain villages on the outskirts of the city. The younger generation tends to speak Jakarta Indonesian.  The project was started in June 2004. There have been twelve recordings which are collected randomly from the speakers who live or have lived in some regions in Jakarta. The regions are Kampung Melayu, Pasar Rebo, Pondok Gede, Ulujami, and Jagakarsa. Most of the regions, except Kampung Melayu, are situated on the outskirts of Jakarta. Pasar Rebo is situated at the very southeast edge of Jakarta, bordering Bogor, West Java. Pondok Gede is also situated at the very southeast edge of Jakarta, bordering Bekasi and Bogor, West Java. Ulujami is situated in South Jakarta, bordering Banten, West Java and Jagakarsa is situated in South Jakarta, bordering Depok, West Java. There are around fifteen native speakers from the total recordings, the speakers are above thirty years old. They still speak with a deep Betawi accent. The rest of the speakers are from younger generation and other ethnicities. For future plan, more recordings will be done with the native speakers from other areas of Jakarta.	48	Primary	1	1	Jakarta Indonesian
907309133204170200	10	1.0040409361328727e+23	hɛpi	happy	happy	happy	2445	SD-120702	1021	0:31:05	NA	876	EXPLAN	tau-tau pagi... sore-sore pulang, jam delapan malem, lagi nyanyi-nyanyi, ‘happy birthday...’	tautau pagi sɔrɛsɔrɛ pulaŋ jam dəlapan maləm lagi ɲaɲiaɲi hɛpi bətdɛy	tau ~ tau pagi sore ~ sore pulang jam delapan malem lagi nyanyi ~ nyanyi happy birthday	know ~ know morning late.afternoon ~ late.afternoon return clock eight night more sing ~ sing happy birthday	suddenly, in the morning... afternoon, when you go home, at eight, people are singing, ‘happy birthday...’	NA	imagining the condition when FRA forgets to buy the lolly pops for his birthday nieces or nephews.	61	Bandung Indonesian	2002-07-12	Bandung	West Java	NA	NA	NA	NA	Spoken	Natural	talking in the living room of VIVSD’s home.	0:31:28	1036	4800	Other Western Varieties of Indonesian (Bandung, Tanggerang Chinese Malay, Padang)	18	Malayic Languages of Java	Bandung is Indonesia's second largest city, but is also the capital of Priangan, the Sundanese speaking region of western Java. Practically all of its ethnic Sundanese inhabitants, as well as many members of the Chinese community and other long-term migrants, are bilingual in Sundanese and Indonesian. This has brought about a strong Sundanese influence on the variety of Indonesian spoken in the city. This variety seems to be closely related to Jakarta Indonesian, which also has significant Sundanese influence, but this influence is naturally much stronger in Bandung, and extends to the phonology, morphology, and syntax, as well as the lexicon.	4	Primary	1	1	Bandung Indonesian
356036113035141200	1	10040409552852027e7	bahagiya	bahagia	bahagia	happy	2053	PDG-20071001-SANb	466	0:27:09	NA	2563	SAFSAN	bahagia di dunia.	bahagiya di duniya	bahagia di dunia	happy LOC world	NA	bahagia di dunia.	NA	48	Minangkabau	2007-01-10	Padang	West Sumatra	-0.955445	100.357958	Conversation	NA	Spoken	Natural	Percakapan dilakukan di rumah Syafril Chatib yang merupakan pensiunan wakil walikota Solok. Speaker membicarakan tentang sejarah Minangkabau.	0:52:44	1015	6732	Minangkabau (various dialects)	19	Malayic Languages of Sumatra	NA	175	Primary	1	1	Minangkabau, Padang
410707113121141200	2	10040409552852027e7	baʔagiya	bahagia	bahagia	happy	2053	PDG-20071001-SANb	467	0:27:10	NA	2563	SAFSAN	untuk bahagia di akhirat a ingek awak beamalan.	ʔuntuʔ baʔagiya di ʔaʔhirat ʔa ʔiŋeʔ awaʔ beʔamalan	untuk bahagia di akhirat a ingek awak be- amal -an	for happy LOC afterworld what remember 1 BE- good.deed -AN	NA	untuk bahagia di akhirat ingat dengan amalan kita.	NA	48	Minangkabau	2007-01-10	Padang	West Sumatra	-0.955445	100.357958	Conversation	NA	Spoken	Natural	Percakapan dilakukan di rumah Syafril Chatib yang merupakan pensiunan wakil walikota Solok. Speaker membicarakan tentang sejarah Minangkabau.	0:52:44	1015	6732	Minangkabau (various dialects)	19	Malayic Languages of Sumatra	NA	175	Primary	1	1	Minangkabau, Padang
631788101936030600	2	1004040945254441e8	gəmbira	gembira	gembira	happy	1910	KER-20080316-FAD	963	0:26:38	NA	2887	SYAKER	e... gembira lagalòw déq?	ʔəː gəmbira lagalɔw deʔ	e gembira la- galòw déq	FILL happy LA- all:A NEG	NA	e.. gembira semuanya kan?	NA	45	Kerinci, Sungai Penuh	2008-03-16	Kerinci	Jambi Province	NA	NA	Conversation	NA	Spoken	Natural	having a conversation in the kitchen; Eni's home.	0:49:12	1653	6918	Kerinci (various dialects)	14	Kerinci (Sungai Penuh)	A corpus of naturalistic speech from the Sungai Penuh dialect of Kerinci.	40	Primary	1	1	Kerinci, Sungai Penuh
824904102118030600	2	1004040945254441e8	gəmbira	gembira	gembira	happy	1910	KER-20080316-FAD	965	0:26:41	NA	2887	SYAKER	iyò, gembira niang uhan.	ʔiyɔ gəmbira niyan ʔuhan	iyò gembira niang uhan	yes:A happy true:N person:O	NA	iya, mereka gembira sekali.	NA	45	Kerinci, Sungai Penuh	2008-03-16	Kerinci	Jambi Province	NA	NA	Conversation	NA	Spoken	Natural	having a conversation in the kitchen; Eni's home.	0:49:12	1653	6918	Kerinci (various dialects)	14	Kerinci (Sungai Penuh)	A corpus of naturalistic speech from the Sungai Penuh dialect of Kerinci.	40	Primary	1	1	Kerinci, Sungai Penuh
922058102333030700	2	1004040945254441e8	gəmbira	gembira	gembira	happy	1910	KER-20080316-FAD	967	0:26:44	NA	2887	SYAKER	a gembira niang (u)hang galòw xx	ʔa gəmbira niyaŋ haŋ galɔw xx	a gembira niang uhang galòw xx	FILL happy true:N person:A all:A xx	NA	mereka semua gembira sekali xx	NA	45	Kerinci, Sungai Penuh	2008-03-16	Kerinci	Jambi Province	NA	NA	Conversation	NA	Spoken	Natural	having a conversation in the kitchen; Eni's home.	0:49:12	1653	6918	Kerinci (various dialects)	14	Kerinci (Sungai Penuh)	A corpus of naturalistic speech from the Sungai Penuh dialect of Kerinci.	40	Primary	1	1	Kerinci, Sungai Penuh
413012092057020740	1	10040410594076758e7	NA	hépi	hépi	happy	2523	PNK-20080627-BES	461	0:19:30	NA	2025	NENPNK	hépi tapi ndaq gituq.	NA	hépi tapi ndaq gituq	happy but NEG like.that	NA	Senang tapi tidak begitu.	tidak narkoba.	69	Middle Indonesia - Pontianak	2008-06-27	Pontianak	West Kalimantan	-0.027853	109.341581	Conversation	NA	Spoken	Natural	a conversation in the living room, taking about Neneng's experience when she was a dencer.	0:47:42	1138	7844	West Kalimantan Malayic (Balai Berkuak, Sambas, Pontianak Malay)	22	Middle Indonesia Project	NA	99	Primary	1	1	Pontianak Malay
377199092245020740	4	10040410594076758e7	NA	hépi	hépi	happy	2523	PNK-20080627-BES	464	0:19:34	NA	885	EXPPNK2	ada banyaq cara hépi.	NA	ada banyaq cara hépi	exist a.lot manner happy	NA	Ada banyak cara senang.	NA	69	Middle Indonesia - Pontianak	2008-06-27	Pontianak	West Kalimantan	-0.027853	109.341581	Conversation	NA	Spoken	Natural	a conversation in the living room, taking about Neneng's experience when she was a dencer.	0:47:42	1138	7844	West Kalimantan Malayic (Balai Berkuak, Sambas, Pontianak Malay)	22	Middle Indonesia Project	NA	99	Primary	1	1	Pontianak Malay
967247155040020700	4	10040410594076758e7	NA	hépi	hépi	happy	2523	PNK-20080627-BES	532	0:22:29	NA	2025	NENPNK	Neng, kau bise hépi gaq ye Neng ye.	NA	Neng kau bise hépi gaq ye Neng ye	Neneng 2SG can happy also yes Neneng yes	NA	Neneng, kamu bisa senang juga ya.	NA	69	Middle Indonesia - Pontianak	2008-06-27	Pontianak	West Kalimantan	-0.027853	109.341581	Conversation	NA	Spoken	Natural	a conversation in the living room, taking about Neneng's experience when she was a dencer.	0:47:42	1138	7844	West Kalimantan Malayic (Balai Berkuak, Sambas, Pontianak Malay)	22	Middle Indonesia Project	NA	99	Primary	1	1	Pontianak Malay
450969155112020740	4	10040410594076758e7	NA	hépi	hépi	happy	2523	PNK-20080627-BES	533	0:22:32	NA	2025	NENPNK	he-eh, aku bise hépi, kratingdéng aku, ku bilang.	NA	he.eh aku bise hépi kratingdéng aku ku bilang	uh.huh 1SG can happy kratingdaeng 1SG 1SG say	NA	Iya, aku bisa senang, kratingdaeng aku, aku bilang.	NA	69	Middle Indonesia - Pontianak	2008-06-27	Pontianak	West Kalimantan	-0.027853	109.341581	Conversation	NA	Spoken	Natural	a conversation in the living room, taking about Neneng's experience when she was a dencer.	0:47:42	1138	7844	West Kalimantan Malayic (Balai Berkuak, Sambas, Pontianak Malay)	22	Middle Indonesia Project	NA	99	Primary	1	1	Pontianak Malay
795891072339220700	3	1004040945254441e8	NA	gembira	gembira	happy	2521	PNK-20080622b-YUD	715	0:22:06	NA	2989	TRIPNK	hidup selalu gembira, senyum, gitu.	NA	hidup selalu gembira senyum gitu	live always happy smile like.that	NA	hidup selalu gembira dan tersenyum.	NA	69	Middle Indonesia - Pontianak	2008-06-22	Pontianak	West Kalimantan	-0.027853	109.341581	Conversation	Personal	Spoken	Natural	having a conversation in the living roo; talking about Mr. Trisulo' live, daily and his tought.	1:01:54	1798	7559	West Kalimantan Malayic (Balai Berkuak, Sambas, Pontianak Malay)	22	Middle Indonesia Project	NA	99	Primary	1	1	Indonesian
571070121451220740	3	1004040945254441e8	NA	gembira	gembira	happy	2521	PNK-20080622b-YUD	792	0:24:48	NA	2989	TRIPNK	senang, kita gembira.	NA	senang kita gembira	enjoy 1PL happy	NA	kita senang dan gembira.	NA	69	Middle Indonesia - Pontianak	2008-06-22	Pontianak	West Kalimantan	-0.027853	109.341581	Conversation	Personal	Spoken	Natural	having a conversation in the living roo; talking about Mr. Trisulo' live, daily and his tought.	1:01:54	1798	7559	West Kalimantan Malayic (Balai Berkuak, Sambas, Pontianak Malay)	22	Middle Indonesia Project	NA	99	Primary	1	1	Indonesian
9484425187792023e8	8	10040409552852027e7	NA	bahagia	bahagia	happy	1253	KOE-20080620-IMO	946	0:35:08	NA	1514	KOENUS	saya bilang ini ini kami ini tidak bahagia 0.	NA	saya bilang ini ini kami ini tidak bahagia 0	1sg say this this 1PL.EX this NEG happy 0	I said this, that we’re not happy.	NA	NA	12	Middle Indonesia - Kupang	2008-06-20	Kupang	East Nusa Tenggara	-10.16082	123.600001	Conversation	NA	Spoken	Natural	having a conversation in the garden; talking about vegetables garden	0:38:50	1065	5889	Eastern Varieties of Indonesian (Kupang Malay, Ternate Malay, Papua Malay)	22	Middle Indonesia Project	NA	66	Primary	1	1	Kupang Malay
25545827348420384e7	3	10040410312745654e7	NA	senang	senang	happy	1255	KOE-20080628-ELS	232	0:07:24	NA	1456	KOEGEE	hi beta senang nonton it(u) felem.	NA	hi beta senang nonton itu felem	FILL 1SG happy watch that film	I like watching that film.	NA	NA	12	Middle Indonesia - Kupang	2008-02-28	Kupang	East Nusa Tenggara	-10.16082	123.600001	Conversation	NA	Spoken	Natural	having a conversation in the Nita's room; talking about birthday and television programme.	0:37:53	1187	5593	Eastern Varieties of Indonesian (Kupang Malay, Ternate Malay, Papua Malay)	22	Middle Indonesia Project	NA	66	Primary	1	1	Kupang Malay
8408911465842039e8	5	10040410312745654e7	NA	senang	senang	happy	1255	KOE-20080628-ELS	571	0:19:06	NA	1456	KOEGEE	0 mungkin karna terlalu senang ni pas(t)i son akan jadi a?	NA	0 mungkin karna terlalu senang ni pasti son akan jadi a	0 maybe because too happy this exact NEG will so FILL	0 maybe because of we are very happy so it not, is it?	NA	NA	12	Middle Indonesia - Kupang	2008-02-28	Kupang	East Nusa Tenggara	-10.16082	123.600001	Conversation	NA	Spoken	Natural	having a conversation in the Nita's room; talking about birthday and television programme.	0:37:53	1187	5593	Eastern Varieties of Indonesian (Kupang Malay, Ternate Malay, Papua Malay)	22	Middle Indonesia Project	NA	66	Primary	1	1	Kupang Malay
8538765879592039e8	8	10040411005271444e7	NA	ceria	ceria	happy	1255	KOE-20080628-ELS	652	0:21:54	NA	1508	KOENIT	slamat ulang tahu(n) panjang umur dan selalu ceria e 0.	NA	slamat ulang tahun panjang umur dan selalu ceria e 0	good repeat year long age and always happy FILL 0	happy birthday, have longevity and always be happy 0.	NA	NA	12	Middle Indonesia - Kupang	2008-02-28	Kupang	East Nusa Tenggara	-10.16082	123.600001	Conversation	NA	Spoken	Natural	having a conversation in the Nita's room; talking about birthday and television programme.	0:37:53	1187	5593	Eastern Varieties of Indonesian (Kupang Malay, Ternate Malay, Papua Malay)	22	Middle Indonesia Project	NA	66	Primary	1	1	Kupang Malay
52763882387720384e7	5	10040411005271444e7	NA	ceria	ceria	happy	1255	KOE-20080628-ELS	788	0:26:43	NA	1508	KOENIT	dia pu moto tu ceria setiap saat.	NA	dia pu moto tu ceria se- tiap saat	3SG POSS motto that happy SE- every when	her motto is always be happy.	NA	NA	12	Middle Indonesia - Kupang	2008-02-28	Kupang	East Nusa Tenggara	-10.16082	123.600001	Conversation	NA	Spoken	Natural	having a conversation in the Nita's room; talking about birthday and television programme.	0:37:53	1187	5593	Eastern Varieties of Indonesian (Kupang Malay, Ternate Malay, Papua Malay)	22	Middle Indonesia Project	NA	66	Primary	1	1	Kupang Malay
6727932107962038e8	2	10040410312745654e7	NA	senang	senang	happy	1255	KOE-20080628-ELS	1093	0:34:56	NA	1508	KOENIT	be senang.	NA	be senang	I happy	I like him.	NA	NA	12	Middle Indonesia - Kupang	2008-02-28	Kupang	East Nusa Tenggara	-10.16082	123.600001	Conversation	NA	Spoken	Natural	having a conversation in the Nita's room; talking about birthday and television programme.	0:37:53	1187	5593	Eastern Varieties of Indonesian (Kupang Malay, Ternate Malay, Papua Malay)	22	Middle Indonesia Project	NA	66	Primary	1	1	Kupang Malay
3821137347170856e8	2	10040409454888868e7	NA	girang	girang	happy	1308	TER-20080412-AYU	94	NA	NA	3112	VIKAYU	tante girang.	NA	tante girang	aunt happy	tante girang.	NA	NA	13	Middle Indonesia - Ternate	2008-04-12	Ternate	North Maluku	0.785691	127.382444	Conversation	NA	Spoken	Natural	Percakapan di tempat kos pada malam hari.	NA	712	3946	Eastern Varieties of Indonesian (Kupang Malay, Ternate Malay, Papua Malay)	22	Middle Indonesia Project	NA	41	Primary	1	1	Ternate Malay
1417999103391303e8	7	10040410312745654e7	NA	senang	senang	happy	1252	KOE-20080615-BOB	222	0:06:02	NA	1556	KOEZEN	pokonya ini di dalam hidup tu senang terus...	NA	poko -nya ini di dalam hidup tu senang terus	main -NYA this PREP inside life that happy continue	we have to be always happy in life...	NA	NA	12	Middle Indonesia - Kupang	2008-06-15	Kupang	East Nusa Tenggara	-10.16082	123.600001	Conversation	NA	Spoken	Natural	having a conversation in the veranda; talking about footbal, about their experience, and about school.	0:37:44	1332	5706	Eastern Varieties of Indonesian (Kupang Malay, Ternate Malay, Papua Malay)	22	Middle Indonesia Project	NA	66	Primary	1	1	Kupang Malay
