text_id	sequence_number	word_id	phonetic_transcription	word_form	morphs	gloss	session_id	session_name	sequence_number_text	start_time	end_time	person_id	person_code	text	phonetic_transcription_text	morphs_text	gloss_text	english_translation_text	indonesian_translation	comments	data_set_id	data_set_name	date	location	region	latitude	longitude	genre	subgenre	mode	elicited_or_natural	situation	duration	record_count	word_count	classification	project_id	project_name	description	session_count	primary_or_secondary	n_languoid_id	n_languoid_name	languoid_name_new
14083014580392508e7	3	12012216142183275e7	NA	suké	suké	happy	2898	SBS-20140710	1167	0:29:02.4	0:29:05.9	1685	MAHSBS	mémang dah suké inyan biak mun kawankan aku, bukan nganoqkan.	NA	mémang dah suké inyan biak mun kawan -kan aku bukan ng- anoq -kan	indeed PFCT happy right 3PL if friend -KAN 1SG NEG N- whatchumacallit -KAN	NA	Bukan memuji diri ya, memang suka sekali mereka kalau berkawan dengan saya.	NA	77	Sambas	2014-07-10	Desa Semperiuk B, Kecamatan Jawai Selatan, Kabupaten Sambas	West Kalimantan	NA	NA	Narrative	NA	Spoken	Natural	having conversation in the living room; talking about activity in PKK (Pemberdayaan Kesejahteraan Keluarga) and pilgrimage to Mecca.	1:21:49.19	3248	14885	West Kalimantan Malayic (Balai Berkuak, Sambas, Pontianak Malay)	32	Languages of Western Borneo Documentation Project	NA	76	Primary	1	1	Sambas Malay
14083014580379828e7	6	12012216142183275e7	NA	suké	suké	happy	2898	SBS-20140710	1186	0:29:34.7	0:29:37	1685	MAHSBS	salahké apéké yé nyé biak suké.	NA	salah -ké apé -ké yé nyé biak suké	wrong -KE what -KE that say 3PL happy	NA	Salah tak peduli yang penting mereka senang.	NA	77	Sambas	2014-07-10	Desa Semperiuk B, Kecamatan Jawai Selatan, Kabupaten Sambas	West Kalimantan	NA	NA	Narrative	NA	Spoken	Natural	having conversation in the living room; talking about activity in PKK (Pemberdayaan Kesejahteraan Keluarga) and pilgrimage to Mecca.	1:21:49.19	3248	14885	West Kalimantan Malayic (Balai Berkuak, Sambas, Pontianak Malay)	32	Languages of Western Borneo Documentation Project	NA	76	Primary	1	1	Sambas Malay
1408301458054037e8	4	12012216142183275e7	NA	suké	suké	happy	2898	SBS-20140710	1305	0:32:58.7	0:33:01	1685	MAHSBS	mun kaméq doloq suké inyan bé.	NA	mun kaméq doloq suké inyan bé	if 1PL.EX first happy right BE	NA	Kalau kami dahulu senang sekali.	NA	77	Sambas	2014-07-10	Desa Semperiuk B, Kecamatan Jawai Selatan, Kabupaten Sambas	West Kalimantan	NA	NA	Narrative	NA	Spoken	Natural	having conversation in the living room; talking about activity in PKK (Pemberdayaan Kesejahteraan Keluarga) and pilgrimage to Mecca.	1:21:49.19	3248	14885	West Kalimantan Malayic (Balai Berkuak, Sambas, Pontianak Malay)	32	Languages of Western Borneo Documentation Project	NA	76	Primary	1	1	Sambas Malay
14112522351126903e7	5	10040409552852027e7	NA	bahagia	bahagia	happy	2900	SBS-20141112	282	0:12:05.111	0:12:08.31	2870	SURSBS3	norma keluarga kecil keluarga bahagia.	NA	norma keluarga kecil keluarga bahagia	norm family small family happy	NA	Norma keluarga kecil keluarga bahagia.	NA	77	Sambas	2014-11-12	Desa Sarilaba A, Kecamatan Jawai Selatan, Kabupaten Sambas	West Kalimantan	NA	NA	Conversation	NA	Spoken	Natural	having conversation in the living room; talking about Integrated Services Post (Posyandu - Pos Pelayanan Terpadu) for Program Keluarga Harapan (Family Hope Program)	0:53:21.9	1469	6957	West Kalimantan Malayic (Balai Berkuak, Sambas, Pontianak Malay)	32	Languages of Western Borneo Documentation Project	NA	76	Primary	1	1	Sambas Malay
15032214115450513e7	11	12012216142183275e7	NA	suké	suké	happy	2903	SBS-20150214	1822	1:10:47.52	1:10:53.3	1933	MULSBS	yang mun doloq kan ughang ké pété balik daghi pété suké magiiqing i.	NA	yang mun doloq kan ughang ké pété balik daghi pété suké m- pagi -iq -ing i	REL if first KAN person to timber.company turn.around from timber.company happy N- go -IQ -ING yes	NA	Dahulu kalau orang pulang dari kerja di persuahaan kayu senang mengunjunginya.	NA	77	Sambas	2015-02-14	Desa Sabaran, Kecamatan Jawai Selatan, Kabupaten Sambas	West Kalimantan	NA	NA	Conversation	NA	Spoken	Natural	having conversation in the living room; talking about struggle and determination to get money for live and education.	1:13:59.3	1907	10918	West Kalimantan Malayic (Balai Berkuak, Sambas, Pontianak Malay)	32	Languages of Western Borneo Documentation Project	NA	76	Primary	1	1	Sambas Malay
1506162355339558e8	4	14062401192163784e7	ribaŋ	ribang	ribang	happy	2339	BES-20140807-HEN	616	0:15:02.18	0:15:07	1066	HENHEN	kicekkahlah die, ka ribang kamu lalu libos ni e.	kice?kalah diyə ka ribaŋ kamu lalu libʊs ni e	kicek -kah -lah die ka ribang kamu lalu libos ni e	talk -KAH -LAH 3 FUT happy 2PL pass go.by this EXCL	NA	katakanlah, alangkah senang kalian ini mondar mandir ya.	NA	55	Besemah	2014-08-07	Desa Pelajaran, Pagaralam	West Sumatra	NA	NA	Conversation	NA	Spoken	Natural	di rumah Hendra Pagaralam Sumatera Selatan	0:54:19.553	2049	8367	Other Sumatra Malayic (Langkat, Tapan, Muko-Muko, Besemah, Sarang Lang, Bangka)	19	Malayic Languages of Sumatra	NA	66	Primary	1	1	Besemah
15061703135510943e7	5	1004040945254441e8	gembira	gembira	gembira	happy	2154	PDG-20150127-YSS	398	0:13:16.86	0:13:18.71	888	EXPSAN	si Uwo pesan soda gembira.	si ʔuwo pesan soda gembira	si Uwo pesan soda gembira	PERS Uwo order soda happy	NA	Uwo pesan soda gembira.	sejenis minumam	48	Minangkabau	2015-01-27	Padang	West Sumatra	-0.955445	100.357958	Conversation	NA	spoken	natural	percakapan dengan teman-teman di kantor PFS	1:01:29.019	1718	8362	Minangkabau (various dialects)	19	Malayic Languages of Sumatra	NA	175	Primary	1	1	Indonesian, Padang
15061703135525638e7	2	1004040945254441e8	gembira	gembira	gembira	happy	2154	PDG-20150127-YSS	400	0:13:21.38	0:13:23.65	900	EXPYSS	soda gembira tu apo sabana nyo tu ma.	soda gembira tu ʔapo sabana ɲo tu ma	soda gembira tu apo sa- bana nyo tu ma	soda happy that what SA- very 3 that MA	NA	soda gembira itu sebenarnya apa.	NA	48	Minangkabau	2015-01-27	Padang	West Sumatra	-0.955445	100.357958	Conversation	NA	spoken	natural	percakapan dengan teman-teman di kantor PFS	1:01:29.019	1718	8362	Minangkabau (various dialects)	19	Malayic Languages of Sumatra	NA	175	Primary	1	1	Indonesian, Padang
15061703135552548e7	2	1004040945254441e8	gembira	gembira	gembira	happy	2154	PDG-20150127-YSS	402	0:13:27.33	0:13:28.59	879	EXPLID	tu gembira Uwo.	tu gembira ʔuwo	tu gembira Uwo	that happy Uwo	NA	Uwo jadi gembira.	NA	48	Minangkabau	2015-01-27	Padang	West Sumatra	-0.955445	100.357958	Conversation	NA	spoken	natural	percakapan dengan teman-teman di kantor PFS	1:01:29.019	1718	8362	Minangkabau (various dialects)	19	Malayic Languages of Sumatra	NA	175	Primary	1	1	Indonesian, Padang
1506170313554031e8	6	1004040945254441e8	gembira	gembira	gembira	happy	2154	PDG-20150127-YSS	403	0:13:29.45	0:13:31.39	900	EXPYSS	kan dia warnanya pink, tu gembira.	kan diya warnaɲa piŋ tu gembira	kan dia warna -nya pink tu gembira	KAN 3 color -NYA pink that happy	NA	karena warnanya pink, makanya kesannya gembira.	NA	48	Minangkabau	2015-01-27	Padang	West Sumatra	-0.955445	100.357958	Conversation	NA	spoken	natural	percakapan dengan teman-teman di kantor PFS	1:01:29.019	1718	8362	Minangkabau (various dialects)	19	Malayic Languages of Sumatra	NA	175	Primary	1	1	Indonesian, Padang
15061703140564992e7	2	10040409552852027e7	bahagiya	bahagia	bahagia	happy	2154	PDG-20150127-YSS	1313	0:47:28.25	0:47:29.63	871	EXPFAD	pasti bahagia urang ma.	pasti bahagiya ʔuraŋ ma	pasti bahagia urang ma	sure happy person MA	NA	pasti semua orang jadi bahagia.	NA	48	Minangkabau	2015-01-27	Padang	West Sumatra	-0.955445	100.357958	Conversation	NA	spoken	natural	percakapan dengan teman-teman di kantor PFS	1:01:29.019	1718	8362	Minangkabau (various dialects)	19	Malayic Languages of Sumatra	NA	175	Primary	1	1	Indonesian, Padang
15062209212929935e7	6	1506220935534244e8	riyaʔ	ria	ria	happy	1505	BKS-20120218	836	0:22:27.578	0:22:30.103	443	BTJGUN	ah ada kan suka panjang-panjang ria xxx.	ʔã ʔada kan sukaʔ panjaŋpanjaŋ riyaʔ xxx	ah ada kan suka panjang ~ panjang ria xxx	EXCL exist KAN often long ~ long happy xxx	they tend to be pronounced in a long xxx.	NA	referring to Bekasi dialect.	18	Bekasi Project	2012-02-18	Kampung Ujung Harapan, Bekasi, West Java	West Java	NA	NA	Conversation	NA	Spoken	Natural	chatting in the livingroom, discussing about Bekasi traditional quatrains collected by the main informant	1:01:08.02	2451	9723	Jakarta Indonesian	9	Jakarta Indonesian	NA	1	Primary	1	1	Bekasi
15062209214184802e7	2	10040410281910923e7	sənəŋ	seneng	seneng	happy	1505	BKS-20120218	1898	0:48:55.716	0:49:00.52	443	BTJGUN	saya seneng kok eh... ente menanggap saya... ini kan xxx, ini kan ditanggap ni.	sa sənəŋ kɔʔ ʔə̃ ʔentɛ mənaŋgap saya ʔini kan xxx ʔini kan ditaŋgap ni	saya seneng kok eh ente men- anggap saya ini kan xxx ini kan di- tanggap ni	1SG happy KOK EXCL you MEN- consider 1SG this KAN xxx this KAN DI- hire.performer this	I am glad that you... you hire me for doing a performance... xxx this means that I'm hired for doing a performance.	NA	NA	18	Bekasi Project	2012-02-18	Kampung Ujung Harapan, Bekasi, West Java	West Java	NA	NA	Conversation	NA	Spoken	Natural	chatting in the livingroom, discussing about Bekasi traditional quatrains collected by the main informant	1:01:08.02	2451	9723	Jakarta Indonesian	9	Jakarta Indonesian	NA	1	Primary	1	1	Bekasi
15062603362290158e7	3	15062603404166642e7	NA	iyaŋ	iyaŋ	happy:A	2366	RAN-20120927-DOL	260	0:11:28.79	0:11:33.41	1843	MINDOL	da ado iyaŋ kuh... masaʔ sabaɲaʔ itu anu noh... uhaŋ awaʔ na tu...	NA	idaʔ ado iyaŋ akuh masaʔ sa- baɲaʔ itu anu noh uhaŋ awaʔ na tu	NEG:A exist:A happy:A QUOT.1SG cook:A SA- many:A that:N whatchamacallit:A EXCL person:A 1:A REL that:N	NA	saya tidak suka... masak orang sebanyak itu...	NA	57	Rantau Panjang	2012-09-27	Rantau Panjang	Jambi Province	NA	NA	Narrative	NA	Spoken	Natural	mengambil rekaman di dalam sebuah rumah yang tidak terlalu banyak gangguan di Rantau Panjang.	0:46:59.67	1047	5502	Other Sumatra Malayic (Langkat, Tapan, Muko-Muko, Besemah, Sarang Lang, Bangka)	7	Rantau Panjang	NA	23	Primary	1	1	Rantau Panjang
15062802205844125e7	4	15062802233042673e7	NA	hepi	hepi	happy:A	2371	RAN-20120930-DOLa	78	0:03:41.34	0:03:43.01	909	FAHDOL	itu kan lbɪh hepi.	NA	itu kan lbɪh hepi	that:N KAN more:A happy:A	NA	tapi kan lebih menyenangkan.	NA	57	Rantau Panjang	2012-09-30	Rantau Panjang	Jambi Province	NA	NA	Narrative	NA	Spoken	Natural	Merekam audio di sebuah rumah yang berada di tepi jalan. Sedikit banyak gangguan suara lain, tapi masih bisa diatasi. Isi cerita bertemakan tentang beberapa orang yang sedang mengikuti bisnis K-Link. Dan sebagian besar bercerita tanteng bisnis itu.	0:43:42.352	986	5168	Other Sumatra Malayic (Langkat, Tapan, Muko-Muko, Besemah, Sarang Lang, Bangka)	7	Rantau Panjang	NA	23	Primary	1	1	Rantau Panjang
15062804072961517e7	12	15062600140066453e7	NA	bahagiya	bahagiya	happy:N	2374	RAN-20130529-DOL	419	0:20:50.39	0:20:56.89	354	BAHDOL	'biya la naʔ... daʔ ɲo apo inᵈʊʔ basah... asal go anaʔ bahagiya' kato kuh... 'mudah-mudahan anaʔ dapeʔ'.	NA	biya lah naʔ idaʔ ɲo apo inᵈʊʔ basah asal go anaʔ bahagiya kato akuh mudah ~ mudah -an anaʔ dapeʔ	let:A LAH:N TRU.child:N NEG:A 3SG what:A mother:A wet:A provided.that:A also:N child:A happy:N word:A QUOT.1SG cheap:A ~ cheap:A -AN child:A get:A	NA	'biarkan saja ibu basah nak... asalkan anak ibu bahagia... semoga anak mendapatkan cita-cita nya' kata saya.	NA	57	Rantau Panjang	2012-05-29	Rantau Panjang	Jambi Province	NA	NA	Narrative	NA	Spoken	Natural	Mengambil rekaman di rumah yang tidak begitu banyak suara yang mengganggu. Tema terita tentang kempanye dan kisah kehidupan BAHDOL sebelum menikah.	0:55:37.35	1058	7754	Other Sumatra Malayic (Langkat, Tapan, Muko-Muko, Besemah, Sarang Lang, Bangka)	7	Rantau Panjang	NA	23	Primary	1	1	Rantau Panjang
15062823210581447e7	4	15062600140066453e7	NA	bahagiya	bahagiya	happy:N	2372	RAN-20120930-DOLb	122	0:06:31.99	0:06:33.78	2834	SUFDOL	'biyar miskin asal bahagiya'.	NA	biyar mskin asal bahagiya	let:N poor:N provided.that:A happy:N	"""It's okay to be poor as long as (we're) happy""."	'biar miskin asal bahagia'.	NA	57	Rantau Panjang	2012-09-30	Rantau Panjang	Jambi Province	NA	NA	Narrative	NA	Spoken	Natural	Merekam audio di sebuah rumah yang berada di tepi jalan. Sedikit banyak gangguan suara lain, tapi masih bisa diatasi. Isi cerita bertemakan tentang beberapa orang yang sedang mengikuti bisnis K-Link. Dan sebagian besar bercerita tanteng bisnis itu.	0:31:46.53	566	3392	Other Sumatra Malayic (Langkat, Tapan, Muko-Muko, Besemah, Sarang Lang, Bangka)	7	Rantau Panjang	NA	23	Primary	1	1	Rantau Panjang
15062823210583502e7	4	15062600140066453e7	NA	bahagiya	bahagiya	happy:N	2372	RAN-20120930-DOLb	123	0:06:33.79	0:06:35.84	2834	SUFDOL	bisa daʔ batmu bahagiya kalo miskin?	NA	bisa idaʔ ba- tmu bahagiya kalaw mskin	can:N NEG:A BA- meet:A happy:N TOP:A poor:N	Can we be happy if we're poor?	apakah bisa bahagia bila kita miskin?	NA	57	Rantau Panjang	2012-09-30	Rantau Panjang	Jambi Province	NA	NA	Narrative	NA	Spoken	Natural	Merekam audio di sebuah rumah yang berada di tepi jalan. Sedikit banyak gangguan suara lain, tapi masih bisa diatasi. Isi cerita bertemakan tentang beberapa orang yang sedang mengikuti bisnis K-Link. Dan sebagian besar bercerita tanteng bisnis itu.	0:31:46.53	566	3392	Other Sumatra Malayic (Langkat, Tapan, Muko-Muko, Besemah, Sarang Lang, Bangka)	7	Rantau Panjang	NA	23	Primary	1	1	Rantau Panjang
15062823210537449e7	4	15062600140066453e7	NA	bahagiya	bahagiya	happy:N	2372	RAN-20120930-DOLb	131	0:06:52.23	0:06:54.15	2834	SUFDOL	'biyar miskin asal bahagiya'.	NA	biyar mskin asal bahagiya	let:N poor:N provided.that:A happy:N	"""It's okay to be poor as long as (we're) happy""."	'biar miskin asal bahagia'.	NA	57	Rantau Panjang	2012-09-30	Rantau Panjang	Jambi Province	NA	NA	Narrative	NA	Spoken	Natural	Merekam audio di sebuah rumah yang berada di tepi jalan. Sedikit banyak gangguan suara lain, tapi masih bisa diatasi. Isi cerita bertemakan tentang beberapa orang yang sedang mengikuti bisnis K-Link. Dan sebagian besar bercerita tanteng bisnis itu.	0:31:46.53	566	3392	Other Sumatra Malayic (Langkat, Tapan, Muko-Muko, Besemah, Sarang Lang, Bangka)	7	Rantau Panjang	NA	23	Primary	1	1	Rantau Panjang
15062823210539919e7	2	15062600140066453e7	NA	bahagiya	bahagiya	happy:N	2372	RAN-20120930-DOLb	135	0:06:59.19	0:07:02.15	2834	SUFDOL	kalo bahagiya tu lain... menikmati bahagiya tu.	NA	kalaw bahagiya tu lain me- nikmat -i bahagiya tu	TOP:A happy:N that:N other:N ME- enjoy:N -I happy:N that:N	If being happy is different... because happiness is enjoyment.	kalau bahagia itu berbeda... karena bahagia itu adalah menikmati.	NA	57	Rantau Panjang	2012-09-30	Rantau Panjang	Jambi Province	NA	NA	Narrative	NA	Spoken	Natural	Merekam audio di sebuah rumah yang berada di tepi jalan. Sedikit banyak gangguan suara lain, tapi masih bisa diatasi. Isi cerita bertemakan tentang beberapa orang yang sedang mengikuti bisnis K-Link. Dan sebagian besar bercerita tanteng bisnis itu.	0:31:46.53	566	3392	Other Sumatra Malayic (Langkat, Tapan, Muko-Muko, Besemah, Sarang Lang, Bangka)	7	Rantau Panjang	NA	23	Primary	1	1	Rantau Panjang
15062823210539919e7	6	15062600140066453e7	NA	bahagiya	bahagiya	happy:N	2372	RAN-20120930-DOLb	135	0:06:59.19	0:07:02.15	2834	SUFDOL	kalo bahagiya tu lain... menikmati bahagiya tu.	NA	kalaw bahagiya tu lain me- nikmat -i bahagiya tu	TOP:A happy:N that:N other:N ME- enjoy:N -I happy:N that:N	If being happy is different... because happiness is enjoyment.	kalau bahagia itu berbeda... karena bahagia itu adalah menikmati.	NA	57	Rantau Panjang	2012-09-30	Rantau Panjang	Jambi Province	NA	NA	Narrative	NA	Spoken	Natural	Merekam audio di sebuah rumah yang berada di tepi jalan. Sedikit banyak gangguan suara lain, tapi masih bisa diatasi. Isi cerita bertemakan tentang beberapa orang yang sedang mengikuti bisnis K-Link. Dan sebagian besar bercerita tanteng bisnis itu.	0:31:46.53	566	3392	Other Sumatra Malayic (Langkat, Tapan, Muko-Muko, Besemah, Sarang Lang, Bangka)	7	Rantau Panjang	NA	23	Primary	1	1	Rantau Panjang
15062823210669883e7	2	15062600140066453e7	NA	bahagiya	bahagiya	happy:N	2372	RAN-20120930-DOLb	136	0:07:02.23	0:07:04.51	3244	YADDOL	barti bahagiya di ɲo miskin.	NA	b- arti bahagiya di ɲo mskin	B- meaning:A happy:N LOC:N 3SG poor:N	It means they are happy when (they're) poor.	artinya mereka bahagia ketika miskin.	NA	57	Rantau Panjang	2012-09-30	Rantau Panjang	Jambi Province	NA	NA	Narrative	NA	Spoken	Natural	Merekam audio di sebuah rumah yang berada di tepi jalan. Sedikit banyak gangguan suara lain, tapi masih bisa diatasi. Isi cerita bertemakan tentang beberapa orang yang sedang mengikuti bisnis K-Link. Dan sebagian besar bercerita tanteng bisnis itu.	0:31:46.53	566	3392	Other Sumatra Malayic (Langkat, Tapan, Muko-Muko, Besemah, Sarang Lang, Bangka)	7	Rantau Panjang	NA	23	Primary	1	1	Rantau Panjang
15070822140914869e7	2	1004040945254441e8	gəmbira	gembira	gembira	happy	1940	KER-20150225-FAD	961	0:27:21.515	0:27:22.72	1961	MYSKER	nyó gembira.	ɲo gəmbira	nyó gembira	3:N happy	NA	harus gembira.	NA	45	Kerinci, Sungai Penuh	2015-02-25	Kerinci	Jambi Province	NA	NA	Conversation	NA	Spoken	Natural	This session talking about the birth of Padlan' son, stroke desease which experiencing SYAKER.	0:31:58.37	1147	5262	Kerinci (various dialects)	14	Kerinci (Sungai Penuh)	A corpus of naturalistic speech from the Sungai Penuh dialect of Kerinci.	40	Primary	1	1	Kerinci, Sungai Penuh
393939100100031e3	5	10040412150075136e7	NA	ladɐys	ladɐys	glad	1641	SAR-130907_a	659	00:38:22	NA	2909	TAKSAR	ha daɣɐn͡t təh ŋambiʔ ladɐys we.	NA	ha daɣɐn͡t təh ŋ- ambiʔ ladɐys we	EXCL land that N- take glad just	NA	Nah, di Darat itu kita hanya mengambil asyiknya saja.	NA	23	Sarolangun	2007-09-13	Jernih, Kabupaten Sarolangun	Jambi Province	NA	NA	Narrative	NA	Spoken	Natural	‘Daily activities telling’.	1:00:22	1154	6499	Jambi (city and surrounding villages)	25	Sarolangun	A corpus of naturalistic speech from Sarulangun.	32	Primary	1	1	Sungai Jernih Sarolangun
915552102402041e3	3	10040412150075136e7	NA	ladɐys	ladɐys	glad	1641	SAR-130907_a	939	00:51:34	NA	2909	TAKSAR	hakaliy liwantah ladɐys idɐʔ?	NA	ha- kaliy liwan͡t -ah ladɐys idɐʔ	HA- time pass -AH glad NEG	NA	Asyiknya cuma sesaat, kan?	NA	23	Sarolangun	2007-09-13	Jernih, Kabupaten Sarolangun	Jambi Province	NA	NA	Narrative	NA	Spoken	Natural	‘Daily activities telling’.	1:00:22	1154	6499	Jambi (city and surrounding villages)	25	Sarolangun	A corpus of naturalistic speech from Sarulangun.	32	Primary	1	1	Sungai Jernih Sarolangun
1.0925610240204101e+17	5	10040412150075136e7	NA	ladɐys	ladɐys	glad	1641	SAR-130907_a	940	00:51:35	NA	2909	TAKSAR	inaʔ, inaʔ maɲcik təh ladɐys təɣoys.	NA	inaʔ inaʔ m- paɲcik təh ladɐys təɣoys	delicious delicious M- fish that glad continue	NA	Lebih baik memancing saja karena asyiknya terus menerus.	NA	23	Sarolangun	2007-09-13	Jernih, Kabupaten Sarolangun	Jambi Province	NA	NA	Narrative	NA	Spoken	Natural	‘Daily activities telling’.	1:00:22	1154	6499	Jambi (city and surrounding villages)	25	Sarolangun	A corpus of naturalistic speech from Sarulangun.	32	Primary	1	1	Sungai Jernih Sarolangun
249110083818061e3	3	10040412150075136e7	NA	ladɐys	ladɐys	glad	1641	SAR-130907_a	1004	00:53:52	NA	279	ASSAR	ha, te ladɐys.	NA	ha te ladɐys	EXCL word glad	NA	"merek hanya menjawab, ""kesenangan."""	NA	23	Sarolangun	2007-09-13	Jernih, Kabupaten Sarolangun	Jambi Province	NA	NA	Narrative	NA	Spoken	Natural	‘Daily activities telling’.	1:00:22	1154	6499	Jambi (city and surrounding villages)	25	Sarolangun	A corpus of naturalistic speech from Sarulangun.	32	Primary	1	1	Sungai Jernih Sarolangun
607720083818061e3	2	10040412150075136e7	NA	ladɐys	ladɐys	glad	1641	SAR-130907_a	1005	00:53:54	NA	279	ASSAR	"""he, ladɐys ɲəlah, te, pəgiy bəladɐys ɲəla"", te."	NA	he ladɐys ɲəlah te pəgiy bə- ladɐys ɲəla te	EXCL glad indeed word go BE- glad indeed word	NA	"""kami hanya mencari senang saja"", jawab mereka."	NA	23	Sarolangun	2007-09-13	Jernih, Kabupaten Sarolangun	Jambi Province	NA	NA	Narrative	NA	Spoken	Natural	‘Daily activities telling’.	1:00:22	1154	6499	Jambi (city and surrounding villages)	25	Sarolangun	A corpus of naturalistic speech from Sarulangun.	32	Primary	1	1	Sungai Jernih Sarolangun
465007083818061e3	2	10040412150075136e7	NA	ladɐys	ladɐys	glad	1641	SAR-130907_a	1006	00:53:56	NA	279	ASSAR	iti ladɐys ŋulah ikat, gunoa nubu toh ŋampays.	NA	iti ladɐys ŋ- ulah ikat guno -a n- tubu toh ŋ	mean glad N- manner fish use -A N- poison that N	NA	berarti mencari ikan itu senang, apalagi kalau menuba ikan, ikannya banyak yang mati.	NA	23	Sarolangun	2007-09-13	Jernih, Kabupaten Sarolangun	Jambi Province	NA	NA	Narrative	NA	Spoken	Natural	‘Daily activities telling’.	1:00:22	1154	6499	Jambi (city and surrounding villages)	25	Sarolangun	A corpus of naturalistic speech from Sarulangun.	32	Primary	1	1	Sungai Jernih Sarolangun
1508231651583965e8	3	1508231652485259e8	NA	sənang	sənang	happy	2818	PNK-20090225	61	0:01:23	NA	1792	MAY	dah agaʔ sənang diyə tu kan, rumah banyaʔ.	NA	dah agaʔ sənang diyə tu kan rumah banyaʔ	already rather happy 3SG that KAN house a.lot	their lives are already pretty comfortable, you know. They own a lot of houses.	hidup mereka sudah mapan, rumahnya banyak.	NA	76	Pontianak Malay	2009-02-25	Pontianak, letak rumahnya agak jauh dari pusat kota dan rumahnya di seberang sungai.	West Kalimantan	NA	NA	Conversation	NA	Spoken	Natural	rekaman dilakukan di rumah speaker, agak jauh dari pusat kota di pinggiran sungai Kapuas. beruntung kapal bermotor tidak banyak lewat dan posisi rumah tidak menghadap langsung ke arah sungai. Speaker punya seorang anak berumur tiga tahun, nakal dan sangat aktif. suara microphone tidak terlalu bersih karena angin agak kencang dan rekaman dilakukan di beranda rumahnya.	0:12:48	473	2097	West Kalimantan Malayic (Balai Berkuak, Sambas, Pontianak Malay)	32	Languages of Western Borneo Documentation Project	NA	18	Primary	1	1	Pontianak Malay
1508231703136855e8	4	1508231652485259e8	NA	sənang	sənang	happy	2819	PNK-20090325-a	1526	0:42:28	NA	1196	INA	ari ini kitə sənang bɛsɔʔ lusaʔ siyapə tau kitə susah...	NA	ari ini kitə sənang bɛsɔʔ lusaʔ siyapə tau kitə susah	day this 1(2) happy tomorrow day.after.tomorrow who know 1(2) 12	today we’re happy, who knows if we suffer the next day...	hari ini kita senang besok lusa siapa tahu kita susah...	NA	76	Pontianak Malay	2009-03-25	Pontianak, seberang sungai Kapuas.	West Kalimantan	NA	NA	Conversation	NA	Spoken	Natural	proses rekaman dilakukan di rumah MAY di pinggir sungai Kapuas. dulu ADI tinggal di depan rumah MAY dan INA sebelum menikah. saat ini keduanya sudah menikah dan punya anak.	0:48:51	1707	9638	West Kalimantan Malayic (Balai Berkuak, Sambas, Pontianak Malay)	32	Languages of Western Borneo Documentation Project	NA	18	Primary	1	1	Pontianak Malay
15082317414545752e7	5	15082317460147205e7	NA	hɛpi	hɛpi	happy	2820	PNK-20110919-a	719	0:18:54.34	0:18:56.11	858	EXPALG	ndaʔ pərnah yang namənyə hɛpi	NA	ndaʔ pərnah yang namə -nyə hɛpi	NEG ever REL name -3SG happy	NA	tidak pernah yang namanya happy	NA	76	Pontianak Malay	2011-09-19	Pontianak, di rumah kediaman ESI di sebuah kompleks perumahan mewah dekat megamall Pontianak.	West Kalimantan	NA	NA	Conversation	Personal	Spoken	Natural	Rekaman tentang perjalanan wisata ESI dan kakak kandungnya ke Gunung Bromo, saat proses reakaman berlangsung, abang iparnya JON yang memiliki rumah di sebelah rumahnya baru tiba dari kampung bersama sopir trucknya.	0:34:17.3	1344	4273	West Kalimantan Malayic (Balai Berkuak, Sambas, Pontianak Malay)	32	Languages of Western Borneo Documentation Project	NA	18	Primary	1	1	Pontianak Malay
15082319135988243e7	3	1508231652485259e8	NA	sənang	sənang	happy	2824	PNK-20130912	1755	0:48:29.698	0:48:33.088	64	ADIALG	iyə... waktu sənang ndaʔ disəbutin misal gituʔ kan...	NA	iyə waktu sənang ndaʔ di- səbut -in misal gituʔ kan	yes time happy NEG DI- mention -IN example like.that KAN	NA	iya... waktu senang tidak disebutkan misalnya begitu kan...	NA	76	Pontianak Malay	2013-09-12	Di rumah speaker, di kawasa TPI (tempat pelelangan ikan), jl. Nipah Kuning, kec.Sungai Rengas, kab. Kubu Raya, Pontianak, Kalbar.	West Kalimantan	NA	NA	Conversation	NA	Spoken	Natural	Rekaman di ambil di rumah speaker ADIALG, rekaman diambil malam hari. Rumah speaker berada tidak jauh dari pasar dan ada suara musik dari toko CD. Topik rekaman adalah tentang kisah beberapa teman dan keluarga speaker.	1:05:43.041	2335	11872	West Kalimantan Malayic (Balai Berkuak, Sambas, Pontianak Malay)	32	Languages of Western Borneo Documentation Project	NA	18	Primary	1	1	Pontianak Malay
15082319140182888e7	2	1508231652485259e8	NA	sənang	sənang	happy	2824	PNK-20130912	1838	0:50:59.47	0:51:01.01	858	EXPALG	diyə sənang lɔ Tɛdi pəgi.	NA	diyə sənang lɔ Tɛdi pəgi	3SG happy LOH Tedi go	NA	dia senang Tedi pergi.	NA	76	Pontianak Malay	2013-09-12	Di rumah speaker, di kawasa TPI (tempat pelelangan ikan), jl. Nipah Kuning, kec.Sungai Rengas, kab. Kubu Raya, Pontianak, Kalbar.	West Kalimantan	NA	NA	Conversation	NA	Spoken	Natural	Rekaman di ambil di rumah speaker ADIALG, rekaman diambil malam hari. Rumah speaker berada tidak jauh dari pasar dan ada suara musik dari toko CD. Topik rekaman adalah tentang kisah beberapa teman dan keluarga speaker.	1:05:43.041	2335	11872	West Kalimantan Malayic (Balai Berkuak, Sambas, Pontianak Malay)	32	Languages of Western Borneo Documentation Project	NA	18	Primary	1	1	Pontianak Malay
