text_id	sequence_number	word_id	phonetic_transcription	word_form	morphs	gloss	session_id	session_name	sequence_number_text	start_time	end_time	person_id	person_code	text	phonetic_transcription_text	morphs_text	gloss_text	english_translation_text	indonesian_translation	comments	data_set_id	data_set_name	date	location	region	latitude	longitude	genre	subgenre	mode	elicited_or_natural	situation	duration	record_count	word_count	classification	project_id	project_name	description	session_count	primary_or_secondary	n_languoid_id	n_languoid_name	languoid_name_new
904649084508070700	3	12093018300193464e7	NA	sna	sna	happy.A	1962	TPMKER-20080306-W	654	00:25:09	NA	245	ARL	kito ndə͡oʔ sna po mcəng.	NA	kito ndə͡oʔ sna po mcəng	1PL FUT.N happy.A what.N variety.O	We (nyah) will be happy or whatever.	NA	NA	46	Kerinci, Tanjung Pauh Mudik	2008-03-06	Tanjung Pauh Mudik	Jambi Province	NA	NA	NA	NA	NA	NA	NA	0:27:48	720	3732	Kerinci (various dialects)	15	Kerinci (Tanjung Pauh)	A corpus of naturalistic speech from the Tanjung Pauh dialect of Kerinci.	36	Primary	1	1	Kerinci, Tanjung Pauh Mudik
311133163405040400	6	12093018300193464e7	NA	sna	sna	happy.A	1964	TPMKER-20080817-B	138	00:33:55	NA	2341	RAK	kalu mahan yudʌ͡e ndɨʔ kito sna.	NA	kalu mahan yudʌ͡e ndɨʔ kito sna	TOP play.A gamble.A NEG 1PL happy.A	As far as gambling is concerned, we won`t be happy.	NA	NA	46	Kerinci, Tanjung Pauh Mudik	2008-08-17	Tanjung Pauh Mudik	Jambi Province	NA	NA	NA	NA	NA	NA	NA	0:10:20	260	1332	Kerinci (various dialects)	15	Kerinci (Tanjung Pauh)	A corpus of naturalistic speech from the Tanjung Pauh dialect of Kerinci.	36	Primary	1	1	Kerinci, Tanjung Pauh Mudik
959633071439170600	1	12093018300193464e7	NA	sna	sna	happy.A	1966	TPMKER-20080817-D	874	00:28:47	NA	1860	MKT	sna nyə ka.	NA	sna nyə ka	happy.A 3.SG eat.A	They (minangnese) enjoyed eating foods.	NA	NA	46	Kerinci, Tanjung Pauh Mudik	2008-08-17	Tanjung Pauh Mudik	Jambi Province	NA	NA	NA	NA	NA	NA	NA	0:36:15	1096	5277	Kerinci (various dialects)	15	Kerinci (Tanjung Pauh)	A corpus of naturalistic speech from the Tanjung Pauh dialect of Kerinci.	36	Primary	1	1	Kerinci, Tanjung Pauh Mudik
683153054638190800	2	12093018300193464e7	NA	sna	sna	happy.A	1970	TPMKER-20090228-B	383	00:21:19	NA	2341	RAK	'hwa sna hwa gwə͡o swʌng,' nyə to.	NA	hwa sna hwa gwə͡o swʌng nyə to	person.A happy.A person.A sit.N village.A 3.SG say.A	'Other people were happy to stay in the village,' he (si bujong) said.	NA	NA	46	Kerinci, Tanjung Pauh Mudik	2009-02-28	Tanjung Pauh Mudik	Jambi Province	NA	NA	NA	NA	NA	NA	NA	0:44:06	911	5615	Kerinci (various dialects)	15	Kerinci (Tanjung Pauh)	A corpus of naturalistic speech from the Tanjung Pauh dialect of Kerinci.	36	Primary	1	1	Kerinci, Tanjung Pauh Mudik
848517104106220800	1	12093018300193464e7	NA	sna	sna	happy.A	1970	TPMKER-20090228-B	474	00:25:19	NA	2341	RAK	sna nyə mmaka.	NA	sna nyə m ~ maka	happy.A 3.SG PART.eat.A ~ eat.A	He (si bujong) ate much food.	NA	NA	46	Kerinci, Tanjung Pauh Mudik	2009-02-28	Tanjung Pauh Mudik	Jambi Province	NA	NA	NA	NA	NA	NA	NA	0:44:06	911	5615	Kerinci (various dialects)	15	Kerinci (Tanjung Pauh)	A corpus of naturalistic speech from the Tanjung Pauh dialect of Kerinci.	36	Primary	1	1	Kerinci, Tanjung Pauh Mudik
250745104145220800	3	12093018300193464e7	NA	sna	sna	happy.A	1970	TPMKER-20090228-B	475	00:25:20	NA	2341	RAK	nyə po sna nyəh.	NA	nyə po sna nyəh	3.SG what.A happy.A 3	He (si bujong) was happy to do anything.	NA	NA	46	Kerinci, Tanjung Pauh Mudik	2009-02-28	Tanjung Pauh Mudik	Jambi Province	NA	NA	NA	NA	NA	NA	NA	0:44:06	911	5615	Kerinci (various dialects)	15	Kerinci (Tanjung Pauh)	A corpus of naturalistic speech from the Tanjung Pauh dialect of Kerinci.	36	Primary	1	1	Kerinci, Tanjung Pauh Mudik
173257112942220800	12	12093018300193464e7	NA	sna	sna	happy.A	1970	TPMKER-20090228-B	572	00:28:56	NA	2341	RAK	dɨy mə͡oʔ nyə ta to, 'ndɛh naʔ,' nyə to, 'mpʌ la sna naʔ,' nyə to.	NA	dɨy mə͡oʔ nyə ta to ndɛh naʔ nyə to mpʌ la sna naʔ nyə to	so.N mother.O 3 afternoon.A say.A gosh.N child.A 3.SG say.A 2SG PAST happy.A child.A 3.SG say.A	His (si bujong) mother said,'oh my (mother) son, you (si bujong) are already rich.'	NA	sna is another word for 'rich.'	46	Kerinci, Tanjung Pauh Mudik	2009-02-28	Tanjung Pauh Mudik	Jambi Province	NA	NA	NA	NA	NA	NA	NA	0:44:06	911	5615	Kerinci (various dialects)	15	Kerinci (Tanjung Pauh)	A corpus of naturalistic speech from the Tanjung Pauh dialect of Kerinci.	36	Primary	1	1	Kerinci, Tanjung Pauh Mudik
831883142306030500	2	12093018300193464e7	NA	sna	sna	happy.A	1956	TPMKER-20080228-H	269	00:10:56	NA	2341	RAK	"""nyo sna"" ka to."	NA	nyo sna ka to	3.SG happy.A 1SG say.A	"""She (ibah) is happy (rich)"" I (kina) said."	NA	NA	46	Kerinci, Tanjung Pauh Mudik	2008-02-28	Tanjung Pauh Mudik	Jambi Province	NA	NA	NA	NA	NA	NA	NA	0:25:05	594	3460	Kerinci (various dialects)	15	Kerinci (Tanjung Pauh)	A corpus of naturalistic speech from the Tanjung Pauh dialect of Kerinci.	36	Primary	1	1	Kerinci, Tanjung Pauh Mudik
303756210036120900	6	10040411113359671e7	sanaŋ	sanang	sanang	happy	1445	Cak-19940913-06	10	00:00:23	NA	529	Caken	ancor, ancor lagi, kita lebe sanang.	ʔaɲcɔr ʔaɲcɔr lagi kita lebe sanaŋ	ancor ancor lagi kita lebe sanang	destroyed destroyed again 1 more happy	it'll be a complete mess and I'm even happier.	NA	NA	16	Ternate Malay (Caken)	1994-09-13	Ternate	North Maluku	0.785691	127.382444	Conversation	Personal	Spoken	Natural	telling stories	0:01:21	41	208	Eastern Varieties of Indonesian (Kupang Malay, Ternate Malay, Papua Malay)	29	Ternate Malay	NA	57	Primary	1	1	Ternate Malay
646382090918291e3	1	11052717224082556e7	hɪpɪ	hepe	hepe	happy	1453	Cak-19940913-14	15	00:00:35	NA	529	Caken	hepe bepe ka bagimana?	hɪpɪ hɪpɪ ka bagimana	hepe bepe ka bagimana	happy birthday or how	happy bappy or how was it again?	NA	NA	16	Ternate Malay (Caken)	1994-09-13	Ternate	North Maluku	0.785691	127.382444	Conversation	Personal	Spoken	Natural	telling stories	0:01:32	38	218	Eastern Varieties of Indonesian (Kupang Malay, Ternate Malay, Papua Malay)	29	Ternate Malay	NA	57	Primary	1	1	Ternate Malay
934534210132121e3	2	1.0040409361328727e+23	hɛpi	happy	happy	happy	1453	Cak-19940913-14	17	00:00:38	NA	529	Caken	oh, happy birthday.	ʔo hɛpi bərTday	oh happy birthday	EXCL happy birthday	o, happy birthday.	NA	NA	16	Ternate Malay (Caken)	1994-09-13	Ternate	North Maluku	0.785691	127.382444	Conversation	Personal	Spoken	Natural	telling stories	0:01:32	38	218	Eastern Varieties of Indonesian (Kupang Malay, Ternate Malay, Papua Malay)	29	Ternate Malay	NA	57	Primary	1	1	Ternate Malay
718163080404160500	5	10040411113359671e7	sanaŋ	sanang	sanang	happy	1499	TerMal-1994-Udin	978	00:33:51	NA	3054	UDI	kan kita pe hati sanang to.	kan kita pe ʔatiʔ sanaŋ tɔʔ	kan kita pe hati sanang to	FILL 1 POSS liver happy FILL	it can make me happy, right?	NA	NA	17	Ternate Malay (other)	1994-01-01	Ternate	North Maluku	0.785691	127.382444	Narrative	Personal	Spoken	Natural	telling stories	0:45:56	1346	6640	Eastern Varieties of Indonesian (Kupang Malay, Ternate Malay, Papua Malay)	30	Ternate Malay	NA	8	Primary	1	1	Ternate Malay
12102216472292503e7	4	12012216142183275e7	NA	suké	suké	happy	2874	SBS-20121003a	81	0:03:19.505	0:03:23.1	2564	SAFSBS	jaq mémang dah suké inyan bé doloq mun nangar dah tujoh balas yé.	NA	jaq mémang dah suké inyan bé doloq mun n- dangar dah tujoh balas yé	just indeed PFCT happy right BE before if N- hear PFCT seven teen that	NA	Memang suka sekali dahulu kalau mendengar tujuh belas itu.	NA	77	Sambas	2012-10-03	Desa Sabaran, Kecamatan Jawai Selatan, Kabupaten Sambas	West Kalimantan	NA	NA	Conversation	NA	Spoken	Natural	having conversation in the living room; talking about the cultivation of rice and citrus.	2:05:50.2	3816	19638	West Kalimantan Malayic (Balai Berkuak, Sambas, Pontianak Malay)	32	Languages of Western Borneo Documentation Project	NA	76	Primary	1	1	Sambas Malay
12102216472335964e7	8	12012216142183275e7	NA	suké	suké	happy	2874	SBS-20121003a	153	0:05:55.595	0:05:58.405	886	EXPPNK3	aoq bé gayé gasaq doloq i caré suké atorannyé bé.	NA	aoq bé gayé gasaq doloq i caré suké ator -an -nyé bé	yes BE like.that real before yes very happy arrange -AN -NYE BE	NA	Ya, begitu rupanya dahulu ya, sungguh menyenangkan.	NA	77	Sambas	2012-10-03	Desa Sabaran, Kecamatan Jawai Selatan, Kabupaten Sambas	West Kalimantan	NA	NA	Conversation	NA	Spoken	Natural	having conversation in the living room; talking about the cultivation of rice and citrus.	2:05:50.2	3816	19638	West Kalimantan Malayic (Balai Berkuak, Sambas, Pontianak Malay)	32	Languages of Western Borneo Documentation Project	NA	76	Primary	1	1	Sambas Malay
1210221647234234e8	5	12012216142183275e7	NA	suké	suké	happy	2874	SBS-20121003a	155	0:05:59.905	0:06:02.205	2564	SAFSBS	jaman-jaman doloq mémang dah suké inyan.	NA	jaman ~ jaman doloq mémang dah suké inyan	period ~ period before indeed PFCT happy right	NA	Zaman-zaman dahlu memang senang sekali.	NA	77	Sambas	2012-10-03	Desa Sabaran, Kecamatan Jawai Selatan, Kabupaten Sambas	West Kalimantan	NA	NA	Conversation	NA	Spoken	Natural	having conversation in the living room; talking about the cultivation of rice and citrus.	2:05:50.2	3816	19638	West Kalimantan Malayic (Balai Berkuak, Sambas, Pontianak Malay)	32	Languages of Western Borneo Documentation Project	NA	76	Primary	1	1	Sambas Malay
1210221647245582e8	2	12012216142183275e7	NA	suké	suké	happy	2874	SBS-20121003a	240	0:08:06.318	0:08:07.51	886	EXPPNK3	eh suké bé atoran.	NA	eh suké bé ator -an	EXCL happy BE arrange -AN	NA	Wah, suka sebenarnya.	NA	77	Sambas	2012-10-03	Desa Sabaran, Kecamatan Jawai Selatan, Kabupaten Sambas	West Kalimantan	NA	NA	Conversation	NA	Spoken	Natural	having conversation in the living room; talking about the cultivation of rice and citrus.	2:05:50.2	3816	19638	West Kalimantan Malayic (Balai Berkuak, Sambas, Pontianak Malay)	32	Languages of Western Borneo Documentation Project	NA	76	Primary	1	1	Sambas Malay
12102216472471893e7	3	12012216142183275e7	NA	suké	suké	happy	2874	SBS-20121003a	267	0:08:59	0:09:03.6	2564	SAFSBS	mémang dah suké inyan juwaq bé doloq méghingatéq bangsé-bangsé tujoh blas Agustus yé.	NA	mémang dah suké inyan juwaq bé doloq m- pégh- ingat -éq bangsé ~ bangsé tujoh blas Agustus yé	indeed PFCT happy right also BE before N- PEN- remember -EQ kind ~ kind seven teen August that	NA	Memang senang sekali memperingati tujuh belas Agustus dahulu.	NA	77	Sambas	2012-10-03	Desa Sabaran, Kecamatan Jawai Selatan, Kabupaten Sambas	West Kalimantan	NA	NA	Conversation	NA	Spoken	Natural	having conversation in the living room; talking about the cultivation of rice and citrus.	2:05:50.2	3816	19638	West Kalimantan Malayic (Balai Berkuak, Sambas, Pontianak Malay)	32	Languages of Western Borneo Documentation Project	NA	76	Primary	1	1	Sambas Malay
12102216472556727e7	1	12012216142183275e7	NA	suké	suké	happy	2874	SBS-20121003a	368	0:12:36.4	0:12:37.9	886	EXPPNK3	suké di mun dah antol ramai.	NA	suké di mun dah antol ramai	happy DI if PFCT near crowded	NA	Memang suka kalau di dekat keramaian.	NA	77	Sambas	2012-10-03	Desa Sabaran, Kecamatan Jawai Selatan, Kabupaten Sambas	West Kalimantan	NA	NA	Conversation	NA	Spoken	Natural	having conversation in the living room; talking about the cultivation of rice and citrus.	2:05:50.2	3816	19638	West Kalimantan Malayic (Balai Berkuak, Sambas, Pontianak Malay)	32	Languages of Western Borneo Documentation Project	NA	76	Primary	1	1	Sambas Malay
12102216472627796e7	3	12012216142183275e7	NA	suké	suké	happy	2874	SBS-20121003a	416	0:13:58.51	0:14:01.1	2564	SAFSBS	mémang dah suké inyan juwaq bé doloq yé.	NA	mémang dah suké inyan juwaq bé doloq yé	indeed PFCT happy right also BE before that	NA	Memang suka sekali dahulu itu.	NA	77	Sambas	2012-10-03	Desa Sabaran, Kecamatan Jawai Selatan, Kabupaten Sambas	West Kalimantan	NA	NA	Conversation	NA	Spoken	Natural	having conversation in the living room; talking about the cultivation of rice and citrus.	2:05:50.2	3816	19638	West Kalimantan Malayic (Balai Berkuak, Sambas, Pontianak Malay)	32	Languages of Western Borneo Documentation Project	NA	76	Primary	1	1	Sambas Malay
12102216474220274e7	5	12012216142183275e7	NA	suké	suké	happy	2874	SBS-20121003a	1727	0:58:57.7	0:59:01.3	2564	SAFSBS	ké mané pun asé suké juwaq kunjongan ké ké itoq ké itoq kanaq undang yé.	NA	ké mané pun asé suké juwaq kunjong -an ké ké itoq ké itoq kanaq undang yé	to which PUN feel happy also visit -AN to to this to this undergo invite that	NA	Suka juga rasanya diundang kunjungan ke mana saja.	NA	77	Sambas	2012-10-03	Desa Sabaran, Kecamatan Jawai Selatan, Kabupaten Sambas	West Kalimantan	NA	NA	Conversation	NA	Spoken	Natural	having conversation in the living room; talking about the cultivation of rice and citrus.	2:05:50.2	3816	19638	West Kalimantan Malayic (Balai Berkuak, Sambas, Pontianak Malay)	32	Languages of Western Borneo Documentation Project	NA	76	Primary	1	1	Sambas Malay
12102216474930115e7	6	12012216142183275e7	NA	suké	suké	happy	2874	SBS-20121003a	2352	1:19:14.9	1:19:16.8	2564	SAFSBS	baik-baik ngan urang kan jaq suké.	NA	baik ~ baik ngan urang kan jaq suké	good ~ good with person KAN just happy	NA	Baik-baik dengan orang kan suka.	NA	77	Sambas	2012-10-03	Desa Sabaran, Kecamatan Jawai Selatan, Kabupaten Sambas	West Kalimantan	NA	NA	Conversation	NA	Spoken	Natural	having conversation in the living room; talking about the cultivation of rice and citrus.	2:05:50.2	3816	19638	West Kalimantan Malayic (Balai Berkuak, Sambas, Pontianak Malay)	32	Languages of Western Borneo Documentation Project	NA	76	Primary	1	1	Sambas Malay
12102216474930908e7	2	12012216142183275e7	NA	suké	suké	happy	2874	SBS-20121003a	2353	1:19:16.615	1:19:17.705	886	EXPPNK3	aoqlah suké, Ning.	NA	aoq -lah suké Ning	yes -LAH happy TRU.Uning	NA	Ya, suka, Ning.	NA	77	Sambas	2012-10-03	Desa Sabaran, Kecamatan Jawai Selatan, Kabupaten Sambas	West Kalimantan	NA	NA	Conversation	NA	Spoken	Natural	having conversation in the living room; talking about the cultivation of rice and citrus.	2:05:50.2	3816	19638	West Kalimantan Malayic (Balai Berkuak, Sambas, Pontianak Malay)	32	Languages of Western Borneo Documentation Project	NA	76	Primary	1	1	Sambas Malay
12102216475480139e7	2	12012216142183275e7	NA	suké	suké	happy	2874	SBS-20121003a	2759	1:32:15.7	1:32:16.96	886	EXPPNK3	jaq suké toq kité.	NA	jaq suké toq kité	just happy this 1PL	NA	Kita suka begitu.	NA	77	Sambas	2012-10-03	Desa Sabaran, Kecamatan Jawai Selatan, Kabupaten Sambas	West Kalimantan	NA	NA	Conversation	NA	Spoken	Natural	having conversation in the living room; talking about the cultivation of rice and citrus.	2:05:50.2	3816	19638	West Kalimantan Malayic (Balai Berkuak, Sambas, Pontianak Malay)	32	Languages of Western Borneo Documentation Project	NA	76	Primary	1	1	Sambas Malay
12102216475557676e7	2	12012216142183275e7	NA	suké	suké	happy	2874	SBS-20121003a	2805	1:33:44.695	1:33:45.705	2564	SAFSBS	yaq suké toq.	NA	yaq suké toq	just happy this	NA	Tetapi suka.	NA	77	Sambas	2012-10-03	Desa Sabaran, Kecamatan Jawai Selatan, Kabupaten Sambas	West Kalimantan	NA	NA	Conversation	NA	Spoken	Natural	having conversation in the living room; talking about the cultivation of rice and citrus.	2:05:50.2	3816	19638	West Kalimantan Malayic (Balai Berkuak, Sambas, Pontianak Malay)	32	Languages of Western Borneo Documentation Project	NA	76	Primary	1	1	Sambas Malay
12102216480269908e7	2	12012216142183275e7	NA	suké	suké	happy	2874	SBS-20121003a	3394	1:53:19.815	1:53:21.505	2564	SAFSBS	mémang suké inyan juwaq bé doloq.	NA	mémang suké inyan juwaq bé doloq	indeed happy right also BE before	NA	Memang suka sekali dahulu.	NA	77	Sambas	2012-10-03	Desa Sabaran, Kecamatan Jawai Selatan, Kabupaten Sambas	West Kalimantan	NA	NA	Conversation	NA	Spoken	Natural	having conversation in the living room; talking about the cultivation of rice and citrus.	2:05:50.2	3816	19638	West Kalimantan Malayic (Balai Berkuak, Sambas, Pontianak Malay)	32	Languages of Western Borneo Documentation Project	NA	76	Primary	1	1	Sambas Malay
12102216480285377e7	2	12012216142183275e7	NA	suké	suké	happy	2874	SBS-20121003a	3418	1:53:59.406	1:54:00.506	886	EXPPNK3	tapi suké biak.	NA	tapi suké biak	but happy 3PL	NA	Tetapi mereka suka.	NA	77	Sambas	2012-10-03	Desa Sabaran, Kecamatan Jawai Selatan, Kabupaten Sambas	West Kalimantan	NA	NA	Conversation	NA	Spoken	Natural	having conversation in the living room; talking about the cultivation of rice and citrus.	2:05:50.2	3816	19638	West Kalimantan Malayic (Balai Berkuak, Sambas, Pontianak Malay)	32	Languages of Western Borneo Documentation Project	NA	76	Primary	1	1	Sambas Malay
12102216480333215e7	1	12012216142183275e7	NA	suké	suké	happy	2874	SBS-20121003a	3497	1:56:24.295	1:56:24.685	2564	SAFSBS	suké.	NA	suké	happy	NA	Suka.	NA	77	Sambas	2012-10-03	Desa Sabaran, Kecamatan Jawai Selatan, Kabupaten Sambas	West Kalimantan	NA	NA	Conversation	NA	Spoken	Natural	having conversation in the living room; talking about the cultivation of rice and citrus.	2:05:50.2	3816	19638	West Kalimantan Malayic (Balai Berkuak, Sambas, Pontianak Malay)	32	Languages of Western Borneo Documentation Project	NA	76	Primary	1	1	Sambas Malay
12102216480367003e7	1	12012216142183275e7	NA	suké	suké	happy	2874	SBS-20121003a	3509	1:56:32.915	1:56:34.005	2564	SAFSBS	suké inyan bé géq.doloq.	NA	suké inyan bé géq.doloq	happy right BE last.time	NA	Suka sekali zaman dahulu.	NA	77	Sambas	2012-10-03	Desa Sabaran, Kecamatan Jawai Selatan, Kabupaten Sambas	West Kalimantan	NA	NA	Conversation	NA	Spoken	Natural	having conversation in the living room; talking about the cultivation of rice and citrus.	2:05:50.2	3816	19638	West Kalimantan Malayic (Balai Berkuak, Sambas, Pontianak Malay)	32	Languages of Western Borneo Documentation Project	NA	76	Primary	1	1	Sambas Malay
1210221648047664e8	5	12012216142183275e7	NA	suké	suké	happy	2874	SBS-20121003a	3545	1:57:32.605	1:57:34.6	2564	SAFSBS	jaman doloq mémang dah suké inyan juwaq bé.	NA	jaman doloq mémang dah suké inyan juwaq bé	period before indeed PFCT happy right also BE	NA	Zaman dahulu memang suka sekali.	NA	77	Sambas	2012-10-03	Desa Sabaran, Kecamatan Jawai Selatan, Kabupaten Sambas	West Kalimantan	NA	NA	Conversation	NA	Spoken	Natural	having conversation in the living room; talking about the cultivation of rice and citrus.	2:05:50.2	3816	19638	West Kalimantan Malayic (Balai Berkuak, Sambas, Pontianak Malay)	32	Languages of Western Borneo Documentation Project	NA	76	Primary	1	1	Sambas Malay
12102216480430114e7	3	12012216142183275e7	NA	suké	suké	happy	2874	SBS-20121003a	3621	1:59:33.405	1:59:36	2564	SAFSBS	mun géq.doloqlah suké inyan juwaq bé.	NA	mun géq.doloq -lah suké inyan juwaq bé	if last.time -LAH happy right also BE	NA	Kalau dahulu senang sekali.	NA	77	Sambas	2012-10-03	Desa Sabaran, Kecamatan Jawai Selatan, Kabupaten Sambas	West Kalimantan	NA	NA	Conversation	NA	Spoken	Natural	having conversation in the living room; talking about the cultivation of rice and citrus.	2:05:50.2	3816	19638	West Kalimantan Malayic (Balai Berkuak, Sambas, Pontianak Malay)	32	Languages of Western Borneo Documentation Project	NA	76	Primary	1	1	Sambas Malay
831864112247210400	6	12110217003527902e7	NA	bahɐgiɐ	bahɐgiɐ	happy	1663	SAR-281006_c	148	00:08:39	NA	1776	MASSAR	'yaŋ pəntiŋ anaʔ kamuw sihan͡t, bahɐgiɐ, nᵈɐʔ dəŋɐn(?)... iyo ɲan ɲo nᵈɐʔ idum͡p dəŋɐn awaʔ.'	NA	yaŋ pəntiŋ anaʔ kamuw sihan͡t bahɐgiɐ nᵈɐʔ dəŋɐn iyo ɲan ɲo nᵈɐʔ idum͡p dəŋɐn awaʔ	REL important child 2PL healthy happy want with yes very 3SG want life with 1SG	‘As long as your daugther is healthy, happy and (she) really wants to live with me.’	"""Yang penting anak bapak sehat, bahagia dan bersungguh-sungguh mau hidup bersamaku"", (kata Muhtar)."	NA	23	Sarolangun	2006-10-28	Jernih, Kabupaten Sarolangun	Jambi Province	NA	NA	Narrative	Traditional folk story	Spoken	Natural	folk tale from Sarolangun	NA	501	3843	Jambi (city and surrounding villages)	25	Sarolangun	A corpus of naturalistic speech from Sarulangun.	32	Primary	1	1	Sungai Jernih Sarolangun
174315133759020700	10	12110217003527902e7	NA	bahɐgiɐ	bahɐgiɐ	happy	1663	SAR-281006_c	174	NA	NA	1776	MASSAR	muko dəbuɐŋ kakaːʔ, kakaːʔ kənal, bɐsu adiʔ koh pastiy bahɐgiɐ, ɲo dɐʔ, məlaɣan͡t.	NA	muko də- buɐŋ kakaːʔ kakaːʔ kənal bɐsu adiʔ koh pastiy bahɐgiɐ ɲo dɐʔ mə- laɣan͡t	so.that DE- throw older.sibling:ABL older.sibling:ABL know language younger.sibling this certain happy 3SG NEG ME- suffer	The reason why he was thrown out by his brother was because his brother knew that if he (Muhtar) were to be happy, his brother would suffer.	Sebab dia dibuang oleh kakak (laki-laki)nya adalah karena kakaknya tahu kalau adiknya akan berbahagia, sementara dia (laki-laki) kesusahan.	NA	23	Sarolangun	2006-10-28	Jernih, Kabupaten Sarolangun	Jambi Province	NA	NA	Narrative	Traditional folk story	Spoken	Natural	folk tale from Sarolangun	NA	501	3843	Jambi (city and surrounding villages)	25	Sarolangun	A corpus of naturalistic speech from Sarulangun.	32	Primary	1	1	Sungai Jernih Sarolangun
7519735356781415e8	2	1004041217283926e8	NA	bahagiɐ	bahagiɐ	happy	1644	SAR-161007_a	27	00:01:16	NA	1776	MASSAR	'idum͡p bahagiɐ.'	NA	idum͡p bahagiɐ	life happy	‘Live happily’...	'Hidup berbahagia.'	This is presumably the mother speaking from beyond.	23	Sarolangun	2007-10-16	Jernih, Kabupaten Sarolangun	Jambi Province	NA	NA	Narrative and conversation	Traditional folk story	Spoken	Natural	"talking about ""Si Pabu"" and The King and Kemang Seed"" (two folktales from Sarolangun) and daily conversation"	0:34:08	825	4844	Jambi (city and surrounding villages)	25	Sarolangun	A corpus of naturalistic speech from Sarulangun.	32	Primary	1	1	Sungai Jernih Sarolangun
865669103715131300	2	1004041215114841e8	NA	naŋ	naŋ	happy	1646	SAR-171107_a	32	00:01:25	NA	279	ASSAR	ɲɐdi naŋ ɲuson kaliman͡t, yih?	NA	ɲ- jɐdi naŋ ɲ- suson kaliman͡t yih	N- become happy N- arrange enteenti YIH	To make it easier when we arrange the sentences, right?	Untuk mempermudah penyusunan kalimatnya, ya?	NA	23	Sarolangun	2007-11-17	Jernih, Kabupaten Sarolangun	Jambi Province	NA	NA	Narrative	Personal story	Spoken	Natural	‘Gold Mining’ and ‘Trip to Jambi story’. (ASSAR experience).	0:31:27	659	3703	Jambi (city and surrounding villages)	25	Sarolangun	A corpus of naturalistic speech from Sarulangun.	32	Primary	1	1	Sungai Jernih Sarolangun
662870114511120100	12	1004041217283926e8	NA	bahagiɐ	bahagiɐ	happy	1657	SAR-241107	146	00:07:15	NA	1776	MASSAR	ha, tapi biɐla ɲo malak datɐys dəniu, pəntek aheran͡t soʔ ɲo bahagiɐ.	NA	ha tapi biɐ -la ɲo malak datɐys dəniu pəntek aheran͡t soʔ ɲo bahagiɐ	EXCL but let -LA 3SG unlucky LOC.above world important here.after tomorrow 3SG happy	But let her suffer in this world, the most important thing is that she will be happy in the life after this.	Tapi biarlah dia malang di atas dunia, yang penting di akhirat besok dia bahagia.	NA	23	Sarolangun	2007-11-24	Jernih, Kabupaten Sarolangun	Jambi Province	NA	NA	Narrative	Personal story	Spoken	Natural	MASSAR life story.	0:34:13	777	4306	Jambi (city and surrounding villages)	25	Sarolangun	A corpus of naturalistic speech from Sarulangun.	32	Primary	1	1	Sungai Jernih Sarolangun
756943114511120100	10	1004041217283926e8	NA	bahagiɐ	bahagiɐ	happy	1657	SAR-241107	150	00:07:30	NA	1776	MASSAR	biɐlah ɲo təh səŋsaɣu datɐys dəniu, pəntek ahiran͡t ɲo bahagiɐ kateɲo.	NA	biɐ -lah ɲo təh səŋsaɣu datɐys dəniu pəntek ahiran͡t ɲo bahagiɐ kate -ɲo	let -LAH 3SG that suffer LOC.above world important here.after 3SG happy word -NYO	Let her suffer in this world, but she will be happy in life after this, she says	Biarlah dia sengsara di atas dunia, namun dia berbahagia di akhirat, katanya.	NA	23	Sarolangun	2007-11-24	Jernih, Kabupaten Sarolangun	Jambi Province	NA	NA	Narrative	Personal story	Spoken	Natural	MASSAR life story.	0:34:13	777	4306	Jambi (city and surrounding villages)	25	Sarolangun	A corpus of naturalistic speech from Sarulangun.	32	Primary	1	1	Sungai Jernih Sarolangun
811152114513120100	3	1004041217283926e8	NA	bahagiɐ	bahagiɐ	happy	1657	SAR-241107	172	00:08:30	NA	1776	MASSAR	uɣak nᵈɐʔ bahagiɐ.	NA	uɣak nᵈɐʔ bahagiɐ	person want happy	People want to be happy.	Orang mau berbahagia.	NA	23	Sarolangun	2007-11-24	Jernih, Kabupaten Sarolangun	Jambi Province	NA	NA	Narrative	Personal story	Spoken	Natural	MASSAR life story.	0:34:13	777	4306	Jambi (city and surrounding villages)	25	Sarolangun	A corpus of naturalistic speech from Sarulangun.	32	Primary	1	1	Sungai Jernih Sarolangun
344515114519120100	3	12110217003527902e7	NA	bahɐgiɐ	bahɐgiɐ	happy	1657	SAR-241107	247	00:12:23	NA	1776	MASSAR	bəlum adu bahɐgiɐ kate tuhat, bəlupla nampaːʔ.	NA	bəlum adu bahɐgiɐ kate tuhat bəlup -la n- tampaːʔ	not.yet exist happy word God not.yet -LA N- look:ABL	If god hadn’t given her happiness yet, then it didn’t appear.	Kalau Allah belum mentakdirkan berbahagia, maka kelihatannya juga belum.	NA	23	Sarolangun	2007-11-24	Jernih, Kabupaten Sarolangun	Jambi Province	NA	NA	Narrative	Personal story	Spoken	Natural	MASSAR life story.	0:34:13	777	4306	Jambi (city and surrounding villages)	25	Sarolangun	A corpus of naturalistic speech from Sarulangun.	32	Primary	1	1	Sungai Jernih Sarolangun
532717140034170100	1	1004041215114841e8	NA	naŋ	naŋ	happy	1657	SAR-241107	417	00:19:59	NA	1776	MASSAR	naŋ cəpan͡t lakuw.	NA	naŋ cəpan͡t lakuw	happy fast sell.well	To make it easier to get a couple.	Supaya mudah mendapatkan pasangan.	NA	23	Sarolangun	2007-11-24	Jernih, Kabupaten Sarolangun	Jambi Province	NA	NA	Narrative	Personal story	Spoken	Natural	MASSAR life story.	0:34:13	777	4306	Jambi (city and surrounding villages)	25	Sarolangun	A corpus of naturalistic speech from Sarulangun.	32	Primary	1	1	Sungai Jernih Sarolangun
