text_id	sequence_number	word_id	phonetic_transcription	word_form	morphs	gloss	session_id	session_name	sequence_number_text	start_time	end_time	person_id	person_code	text	phonetic_transcription_text	morphs_text	gloss_text	english_translation_text	indonesian_translation	comments	data_set_id	data_set_name	date	location	region	latitude	longitude	genre	subgenre	mode	elicited_or_natural	situation	duration	record_count	word_count	classification	project_id	project_name	description	session_count	primary_or_secondary	n_languoid_id	n_languoid_name	languoid_name_new
813590093533030100	12	10040412073739521e7	NA	snaŋ	snaŋ	glad	1690	TJR-121105	405	0:22:43	NA	1984	NASTJR	kagiʔ daʔ, kito kalu yaŋ bʊrʊʔ-bʊrʊʔ kito mrʊtʊʔ-mrʊtʊʔ, yaŋ baɪʔ-baɪʔ kito snaŋ.	kagiʔ daʔ kitoʔ kalu yaŋ bʊɣʊʔ-bʊɣʊʔ kito məɣʊtʊʔ-məɣʊtʊːʔ yaŋ baɪʔ baɪʔ kitoː sənãːŋ	kagiʔ daʔ kito kalu yaŋ bʊrʊʔ ~ bʊrʊʔ kito m- rʊtʊʔ ~ m- rʊtʊʔ yaŋ baɪʔ ~ baɪʔ kito snaŋ	later NEG 1PL TOP REL bad ~ bad 1PL N- grumble ~ N- grumble REL good ~ good 1PL glad	later no, we... the bad ones we grumble, the good ones we are happy.	NA	1. NASTJR pronounced ‘kagiq’ as ‘agiq.’ 2. meant to say ‘don’t take good things only, we may not grumble when we get bad things.’	24	Tanjung Raden	2005-11-12	Jambi	Jambi Province	-1.610415	103.613128	Conversation	NA	Spoken	Natural	talking about Nasrul and his daily activities.	0:58:54	1104	6411	Jambi (city and surrounding villages)	11	Traditional Jambi Malay	NA	52	Primary	1	1	Tanjung Raden Malay
927244114857090200	13	10040412081562487e7	NA	bahagia	bahagia	glad	1690	TJR-121105	1009	0:55:15	NA	1984	NASTJR	harto slamo ko dioʔ... dioʔ prguno(kan) apo tu? ʊntʊʔ anaʔ cucue supayo bahagia, ha ɲatoe xx dioʔ yaŋ 0tɪmᵇʊl susa dalam tana tu.	haɣ̩to slamo ko dioʔ dioʔ pəɣguno apətu ʊntʊʔ anãʔ cucue supayo bahagia hã ɲãtoe xx dioʔ yaŋ tɪm͡bʊl susa dalam tanã tu	harto s- lamo ko dioʔ dioʔ pr- guno -kan apo tu ʊntʊʔ anaʔ cucu -e supayo bahagia ha ɲato -e xx dioʔ yaŋ 0- tɪmᵇʊl susa dalam tana tu	wealth SA- long.time this 3 3 PR- use -KAN what that for child grandchild -E so.that glad EXCL real -E xx 3 REL 0- appear difficult inside soil that	his wealth was... he used it to er... to his descendants in order that they’re happy but the fact is it makes him suffer in the cemetery.	NA	NA	24	Tanjung Raden	2005-11-12	Jambi	Jambi Province	-1.610415	103.613128	Conversation	NA	Spoken	Natural	talking about Nasrul and his daily activities.	0:58:54	1104	6411	Jambi (city and surrounding villages)	11	Traditional Jambi Malay	NA	52	Primary	1	1	Tanjung Raden Malay
713265084941310300	16	10040412073739521e7	NA	snaŋ	snaŋ	glad	1710	TJR-231205_b	553	0:20:02	NA	1335	JUNTJR	sakɪte ha dioʔ jugo susa kan, mli ubat yo apo dioʔ jugo yaŋ... ‘daʔ.do 0dapat snaŋ ati,’ 0te dee.	NA	sakɪt -e ha dioʔ jugo susa kan m- bli ubat yo apo dioʔ jugo yaŋ daʔ.do 0- dapat snaŋ ati 0- te de -e	sick -E EXCL 3 also difficult KAN N- buy medicine yes what 3 also REL NEG.exist 0- get glad liver 0- word 3 -E	when I was sick he worried too, he had to buy medicine for me, he also... ‘I’m sad,’ he said.	NA	NA	24	Tanjung Raden	2005-12-23	Jambi	Jambi Province	-1.610415	103.613128	Conversation	NA	Spoken	Natural	talking about making glutinuous rice cake, JUNTJR's life, and SALMDD's livestock.	0:54:31	1450	6255	Jambi (city and surrounding villages)	11	Traditional Jambi Malay	NA	52	Primary	1	1	Tanjung Raden Malay
350018085024310340	2	10040412073739521e7	NA	snaŋ	snaŋ	glad	1710	TJR-231205_b	982	0:36:39	NA	254	ARNTJR	h-m, snaŋ ati... ɪnᵈT... neŋoʔ kitotu...	NA	h.m snaŋ ati INT n- teŋoʔ kito -tu	uh.huh glad liver INT N- look 1PL -TU	hm, he was glad knowing you’re...	NA	1. INT= iyo. 2. refering to the devil. 3. ARNTJR didn’t continue what she wanted to say.	24	Tanjung Raden	2005-12-23	Jambi	Jambi Province	-1.610415	103.613128	Conversation	NA	Spoken	Natural	talking about making glutinuous rice cake, JUNTJR's life, and SALMDD's livestock.	0:54:31	1450	6255	Jambi (city and surrounding villages)	11	Traditional Jambi Malay	NA	52	Primary	1	1	Tanjung Raden Malay
726768095411010400	9	10040412073739521e7	NA	snaŋ	snaŋ	glad	1710	TJR-231205_b	1256	0:47:28	NA	1335	JUNTJR	bukan ŋato daʔ, bibiko xx bʊrʊʔ ado yaŋ snaŋ lagi dulu mudo-mudo mcam kau daʔ.	NA	bukan ŋ- kato daʔ bibi -ko xx bʊrʊʔ ado yaŋ snaŋ lagi dulu mudo ~ mudo mcam kau daʔ	not N- word NEG aunt -KO xx bad exist REL glad PROG before young ~ young sort 2SG NEG	not to lie, I’m ugly, there was someone who loved me when I was young like you.	NA	meant to say ‘although I was ugly, when I was young, like you know, there was a man who loved me.’	24	Tanjung Raden	2005-12-23	Jambi	Jambi Province	-1.610415	103.613128	Conversation	NA	Spoken	Natural	talking about making glutinuous rice cake, JUNTJR's life, and SALMDD's livestock.	0:54:31	1450	6255	Jambi (city and surrounding villages)	11	Traditional Jambi Malay	NA	52	Primary	1	1	Tanjung Raden Malay
876088140942190500	3	10040412073739521e7	NA	snaŋ	snaŋ	glad	1698	TJR-180106_a	1290	0:48:05	NA	1766	MARTJR	dioʔtu nampaʔ snaŋ edaʔ, istilaetu pnliti-pnlitian di jamᵇi ko.	NA	dioʔ -tu n- tampaʔ snaŋ edaʔ istila -e -tu pn- tliti ~ pn- tliti -an di jamᵇi ko	3 -TU N- look glad NEG term -E -TU PAN- investigate ~ PAN- investigate -AN LOC Jambi this	it seems that they like to conduct a research in Jambi.	NA	NA	24	Tanjung Raden	2006-01-18	Jambi	Jambi Province	-1.610415	103.613128	Conversation	NA	Spoken	Natural	talking about MARTJR's daily activities now and in the past, medicines, MARTJR's children, old words, and MARTJR's visit to Muara Jambi.	0:53:01	1429	6697	Jambi (city and surrounding villages)	11	Traditional Jambi Malay	NA	52	Primary	1	1	Tanjung Raden Malay
977860100825090600	9	10040412073739521e7	NA	snaŋ	snaŋ	glad	1699	TJR-180106_b	265	0:09:57	NA	1766	MARTJR	mukoko kalu di msjɪt edaʔ, nŋar ko, kagi snaŋ aku btaɲo, mintaʔ 0simaʔ.	NA	muko -ko kalu di msjɪt edaʔ n- dŋar ko kagi snaŋ aku b- taɲo m- pintaʔ 0- simaʔ	so.that -KO TOP LOC mosque NEG N- listen this later glad 1SG BA- ask N- ask.for 0- scrutinize	that’s why when I was at a mosque, I’d listen it first so that I could ask someone and asked him to listened to me.	NA	refering to listening to someone who was teaching.	24	Tanjung Raden	2006-01-18	Jambi	Jambi Province	-1.610415	103.613128	Conversation	NA	Spoken	Natural	talking about teaching principles of Islam, Faith, and Prayer, MARTJR's past life, and making a kind of food made of cassava.	0:57:06	1363	7327	Jambi (city and surrounding villages)	11	Traditional Jambi Malay	NA	52	Primary	1	1	Tanjung Raden Malay
597940100848090500	7	10040412073739521e7	NA	snaŋ	snaŋ	glad	1699	TJR-180106_b	517	0:20:33	NA	1766	MARTJR	ha muko kiniko, krjo susa krjo, snaŋ pulaʔ bibi cɪcɪpi.	NA	ha muko kini -ko krjo susa krjo snaŋ pulaʔ bibi cɪcɪp -i	EXCL so.that now -KO work difficult work glad again aunt taste -I	that’s why now, worked hard, I’ll do good jobs.	NA	meant to say ‘that’s why I like to do everything.’	24	Tanjung Raden	2006-01-18	Jambi	Jambi Province	-1.610415	103.613128	Conversation	NA	Spoken	Natural	talking about teaching principles of Islam, Faith, and Prayer, MARTJR's past life, and making a kind of food made of cassava.	0:57:06	1363	7327	Jambi (city and surrounding villages)	11	Traditional Jambi Malay	NA	52	Primary	1	1	Tanjung Raden Malay
231256100849090500	2	10040412073739521e7	NA	snaŋ	snaŋ	glad	1699	TJR-180106_b	531	0:21:05	NA	1766	MARTJR	jaŋan snaŋ be kito cɪcɪpi.	NA	jaŋan snaŋ be kito cɪcɪp -i	do.not glad just 1PL taste -I	not only the good ones.	NA	NA	24	Tanjung Raden	2006-01-18	Jambi	Jambi Province	-1.610415	103.613128	Conversation	NA	Spoken	Natural	talking about teaching principles of Islam, Faith, and Prayer, MARTJR's past life, and making a kind of food made of cassava.	0:57:06	1363	7327	Jambi (city and surrounding villages)	11	Traditional Jambi Malay	NA	52	Primary	1	1	Tanjung Raden Malay
968477100850090500	2	10040412073739521e7	NA	snaŋ	snaŋ	glad	1699	TJR-180106_b	538	0:21:20	NA	1766	MARTJR	jaŋan snaŋ bae kito rasokan, susa kito cɪcɪpi.	NA	jaŋan snaŋ bae kito raso -kan susa kito cɪcɪp -i	do.not glad just 1PL feel -KAN difficult 1PL taste -I	don’t just try the good one, we’ve to try the hard one, too.	NA	refering to work.	24	Tanjung Raden	2006-01-18	Jambi	Jambi Province	-1.610415	103.613128	Conversation	NA	Spoken	Natural	talking about teaching principles of Islam, Faith, and Prayer, MARTJR's past life, and making a kind of food made of cassava.	0:57:06	1363	7327	Jambi (city and surrounding villages)	11	Traditional Jambi Malay	NA	52	Primary	1	1	Tanjung Raden Malay
552376100850090500	2	10040412073739521e7	NA	snaŋ	snaŋ	glad	1699	TJR-180106_b	541	0:21:28	NA	1766	MARTJR	susa snaŋ kan.	NA	susa snaŋ kan	difficult glad KAN	easy and hard.	NA	refering to jobs.	24	Tanjung Raden	2006-01-18	Jambi	Jambi Province	-1.610415	103.613128	Conversation	NA	Spoken	Natural	talking about teaching principles of Islam, Faith, and Prayer, MARTJR's past life, and making a kind of food made of cassava.	0:57:06	1363	7327	Jambi (city and surrounding villages)	11	Traditional Jambi Malay	NA	52	Primary	1	1	Tanjung Raden Malay
426095100850090500	4	10040412073739521e7	NA	snaŋ	snaŋ	glad	1699	TJR-180106_b	543	0:21:31	NA	1766	MARTJR	jaŋan kito mrasokan snaŋ bae xx.	NA	jaŋan kito m- raso -kan snaŋ bae xx	do.not 1PL N- feel -KAN glad just xx	don’t just the good one.	NA	refering to work.	24	Tanjung Raden	2006-01-18	Jambi	Jambi Province	-1.610415	103.613128	Conversation	NA	Spoken	Natural	talking about teaching principles of Islam, Faith, and Prayer, MARTJR's past life, and making a kind of food made of cassava.	0:57:06	1363	7327	Jambi (city and surrounding villages)	11	Traditional Jambi Malay	NA	52	Primary	1	1	Tanjung Raden Malay
926066100852090500	2	10040412073739521e7	NA	snaŋ	snaŋ	glad	1699	TJR-180106_b	559	0:22:16	NA	1766	MARTJR	aku snaŋ...	NA	aku snaŋ	1SG glad	I like...	NA	NA	24	Tanjung Raden	2006-01-18	Jambi	Jambi Province	-1.610415	103.613128	Conversation	NA	Spoken	Natural	talking about teaching principles of Islam, Faith, and Prayer, MARTJR's past life, and making a kind of food made of cassava.	0:57:06	1363	7327	Jambi (city and surrounding villages)	11	Traditional Jambi Malay	NA	52	Primary	1	1	Tanjung Raden Malay
471131082511110700	7	10040412073739521e7	NA	snaŋ	snaŋ	glad	1671	TJR-040206_a	1325	0:47:43	NA	1766	MARTJR	muko kawan kalu dŋan awaʔtu dioʔ snaŋ mancɪŋ.	NA	muko kawan kalu dŋan awaʔ -tu dioʔ snaŋ mancɪŋ	so.that friend TOP with PRO -TU 3 glad fishing.rod	that’s why my friends like fishing with me.’	NA	meant to say ‘my friends likes to go fishing with me.’	24	Tanjung Raden	2006-02-04	Jambi	Jambi Province	-1.610415	103.613128	Conversation	NA	Spoken	Natural	talking about AZATJR's family, MARJTR's family, MARTJR'S experience in fishing, etc.	0:57:10	1583	8025	Jambi (city and surrounding villages)	11	Traditional Jambi Malay	NA	52	Primary	1	1	Tanjung Raden Malay
706569123611160800	10	10040412073739521e7	NA	snaŋ	snaŋ	glad	1666	TJR-030206_b	155	0:09:27	NA	3002	TUMTJR	istilae 0kato oraŋtu apo... apo? badan naŋᵍʊŋ ati yo snaŋ.	NA	istila -e 0- kato oraŋ -tu apo apo badan n- taŋᵍʊŋ ati yo snaŋ	term -E 0- word person -TU what what body N- suffer liver yes glad	it is as what people say as err... what? our body hurts but we’re happy.	NA	NA	24	Tanjung Raden	2006-02-03	Jambi	Jambi Province	-1.610415	103.613128	Conversation	NA	Spoken	Natural	talking about TUMTJR's past life.	0:27:30	526	3118	Jambi (city and surrounding villages)	11	Traditional Jambi Malay	NA	52	Primary	1	1	Tanjung Raden Malay
4.1806412361216083e+17	3	10040412073739521e7	NA	snaŋ	snaŋ	glad	1666	TJR-030206_b	156	0:09:35	NA	3002	TUMTJR	apo daʔ snaŋ, 0dapat bblian gi 0dapat.	NA	apo daʔ snaŋ 0- dapat b- bli -an gi 0- dapat	what NEG glad 0- get BA- buy -AN later 0- get	why I said ‘happy,’ because we could buy whatever we liked.	NA	NA	24	Tanjung Raden	2006-02-03	Jambi	Jambi Province	-1.610415	103.613128	Conversation	NA	Spoken	Natural	talking about TUMTJR's past life.	0:27:30	526	3118	Jambi (city and surrounding villages)	11	Traditional Jambi Malay	NA	52	Primary	1	1	Tanjung Raden Malay
655201112849290800	8	10040412073739521e7	NA	snaŋ	snaŋ	glad	1673	TJR-040206_c	319	0:15:04	NA	1766	MARTJR	ha 0balɪʔ k’ruma bibi sayo di daʔ snaŋ ati, saya 0teŋoʔ plaʔ ka kaco, sayo 0bukaʔ, sayo amᵇɪʔila lnᵈɪr biso ulartu.	NA	ha 0- balɪʔ k'ruma bibi sayo di daʔ snaŋ ati saya 0- teŋoʔ plaʔ ka kaco sayo 0- bukaʔ sayo amᵇɪʔ -i -la lnᵈɪr biso ular -tu	EXCL 0- return to.house aunt 1SG earlier NEG glad liver 1SG 0- look PLAQ to glass 1SG 0- open 1SG take -I -LA slime poison snake -TU	when I was back home, I didn’t feel well, I saw it in the mirror, I opened, I took the poison slime.	NA	meant to say ‘when I reached home, I looked my eye in the mirror, then I opened the bandage and I took the slime of the snake.’	24	Tanjung Raden	2006-02-04	Jambi	Jambi Province	-1.610415	103.613128	Conversation	NA	Spoken	Natural	talking about old prohibitions, proverbs, snakes, MARTJR's and IZATJR's friends, IZATJR's children, and traditional cake, etc.	0:42:45	1185	5797	Jambi (city and surrounding villages)	11	Traditional Jambi Malay	NA	52	Primary	1	1	Tanjung Raden Malay
944087092914211e3	3	10040412073739521e7	NA	snaŋ	snaŋ	glad	1631	MDD-260505_f	249	0:10:37	NA	1677	MADMDD	ɲadi daʔ snaŋ aku...	NA	ɲ- jadi daʔ snaŋ aku	N- become NEG glad 1SG	so disliked I...	NA	= 1.so, because I didn’t like her, I... 2.MADMDD didn’t continue what he wanted to say.	22	Mudung Darat	2005-05-26	Jambi	Jambi Province	-1.610415	103.613128	Conversation	NA	Spoken	Natural	talking about MADMDD's life.	0:18:29	459	2077	Jambi (city and surrounding villages)	11	Traditional Jambi Malay	NA	13	Primary	1	1	Mudung Darat Malay
1.0211209135418101e+17	12	10040412073739521e7	NA	snaŋ	snaŋ	glad	1712	TJR-270605_b	658	0:19:16	NA	779	EKOTJR	aeʔ di umoko ta macam manola kalu kapan neŋoʔ di umotu snaŋ nian neŋoʔe.	NA	aeʔ di umo -ko ta macam mano -la kalu kapan n- teŋoʔ di umo -tu snaŋ nian n- teŋoʔ -e	water LOC paddy -KO not.know sort which -LA TOP when N- look LOC paddy -TU glad very N- look -E	water at the field, I don’t know why, when I saw it at the field I was so happy to see it.	NA	NA	24	Tanjung Raden	2005-06-27	Jambi	Jambi Province	-1.610415	103.613128	Conversation	NA	Spoken	Natural	talking about raising fowl.	0:24:59	827	3646	Jambi (city and surrounding villages)	11	Traditional Jambi Malay	NA	52	Primary	1	1	Tanjung Raden Malay
370578094331181e3	2	10040412073739521e7	NA	snaŋ	snaŋ	glad	1713	TJR-270605_c	51	0:01:47	NA	620	DATTJR	pukattu snaŋ puntal-puntal lpaʔ bawa lante prau.	NA	pukat -tu snaŋ puntal ~ puntal lpaʔ bawa lante prau	net -TU glad roll ~ roll place under floor canoe	the nets are easy, just roll and put under the floor of the canoe.	NA	= it would be easier for him to steal the nets because he could roll them under the floor of the canoe.	24	Tanjung Raden	2005-06-27	Jambi	Jambi Province	-1.610415	103.613128	Conversation	NA	Spoken	Natural	talking about DATTJR's neighbours who often steal his nets and fish traps.	0:03:53	104	521	Jambi (city and surrounding villages)	11	Traditional Jambi Malay	NA	52	Primary	1	1	Tanjung Raden Malay
189628083836311e3	4	10040412081562487e7	NA	bahagia	bahagia	glad	1714	TJR-270605_d	3	0:00:08	NA	2405	RHMTJR	ha, 0ɪdʊp 0nᵈaʔ bahagia, awaʔ lagi mudo, edaʔ paʔ yo?	NA	ha 0- ɪdʊp 0- nᵈaʔ bahagia awaʔ lagi mudo edaʔ paʔ yo	EXCL 0- live 0- want glad PRO more young NEG TRU.father yes	life needs to be happy, you are still young, right my husband?	NA	meant to say ‘you’re still young, you have many opportunities to get happy life.’	24	Tanjung Raden	2005-06-27	Jambi	Jambi Province	-1.610415	103.613128	Conversation	NA	Spoken	Natural	talking about animal stealing and miserable life in Japanese period.	0:18:25	518	2442	Jambi (city and surrounding villages)	11	Traditional Jambi Malay	NA	52	Primary	1	1	Tanjung Raden Malay
311188092940011140	1	10040412073739521e7	NA	snaŋ	snaŋ	glad	1714	TJR-270605_d	109	0:03:51	NA	2405	RHMTJR	snaŋ ati trsra situla.	NA	snaŋ ati tr- sra situ -la	glad liver TAR- surrender there -LA	it’s happy, up to you.	NA	NA	24	Tanjung Raden	2005-06-27	Jambi	Jambi Province	-1.610415	103.613128	Conversation	NA	Spoken	Natural	talking about animal stealing and miserable life in Japanese period.	0:18:25	518	2442	Jambi (city and surrounding villages)	11	Traditional Jambi Malay	NA	52	Primary	1	1	Tanjung Raden Malay
933727205338230900	4	10040412073739521e7	NA	snaŋ	snaŋ	glad	1627	MDD-260505_a	1025	0:50:13	NA	2959	TINMDD	ɲaiʔ haridu memaŋ snaŋ nla ɪdʊpe yo?	NA	ɲaiʔ haridu memaŋ snaŋ nla ɪdʊp -e yo	grandmother before indeed glad indeed alive -E yes	you really had a nice life, right?	NA	NA	22	Mudung Darat	2005-05-26	Jambi	Jambi Province	-1.610415	103.613128	Conversation	NA	Spoken	Natural	Talking about  Abdul Muluk show and growing rice. the participants were sitting in a veranda.	0:50:36	1033	5401	Jambi (city and surrounding villages)	11	Traditional Jambi Malay	NA	13	Primary	1	1	Mudung Darat Malay
687653141940090600	2	10040412073739521e7	NA	snaŋ	snaŋ	glad	1624	MDD-170505_f	658	0:24:33	NA	2358	RASMDD	awaʔ snaŋ... awaʔ ujan daʔ.do gadʊ daʔ, tee.	NA	awaʔ snaŋ awaʔ ujan daʔ.do gadʊ daʔ te -e	PRO glad PRO rain NEG.exist busy NEG word -E	‘it’s better... if it rains, it will not disturb you.’ he said.	NA	NA	22	Mudung Darat	2005-05-17	Jambi	Jambi Province	-1.610415	103.613128	Conversation	NA	Spoken	Natural	RASMDD told about her family and their activities.	1:04:21	1765	6732	Jambi (city and surrounding villages)	11	Traditional Jambi Malay	NA	13	Primary	1	1	Mudung Darat Malay
870413145610090600	6	10040412073739521e7	NA	snaŋ	snaŋ	glad	1624	MDD-170505_f	703	0:25:57	NA	2358	RASMDD	bapɪkɪ kogaʔ, bunula oaŋ ko snaŋ awaʔ amᵇɪʔ motoe, tee.	NA	ba- pɪkɪ kogaʔ bunu -la oaŋ ko snaŋ awaʔ amᵇɪʔ moto -e te -e	BA- think perhaps kill -LA person this glad PRO take motorcycle -E word -E	may be he thought...’I’ll kill this man so that I can take his motorcycle,’ he said.	NA	NA	22	Mudung Darat	2005-05-17	Jambi	Jambi Province	-1.610415	103.613128	Conversation	NA	Spoken	Natural	RASMDD told about her family and their activities.	1:04:21	1765	6732	Jambi (city and surrounding villages)	11	Traditional Jambi Malay	NA	13	Primary	1	1	Mudung Darat Malay
306911141745100600	3	10040412073739521e7	NA	snaŋ	snaŋ	glad	1624	MDD-170505_f	1183	0:43:25	NA	2358	RASMDD	dioʔe oaŋ snaŋ, awaʔko oaŋ srɪt.	NA	dioʔ -e oaŋ snaŋ awaʔ -ko oaŋ srɪt	3 -E person glad PRO -KO person difficult	they are rich, whereas we are poor.	NA	NA	22	Mudung Darat	2005-05-17	Jambi	Jambi Province	-1.610415	103.613128	Conversation	NA	Spoken	Natural	RASMDD told about her family and their activities.	1:04:21	1765	6732	Jambi (city and surrounding villages)	11	Traditional Jambi Malay	NA	13	Primary	1	1	Mudung Darat Malay
244593002539240900	3	10040412073739521e7	NA	snaŋ	snaŋ	glad	1629	MDD-260505_c	81	0:03:08	NA	2574	SALMDD	kalo oaŋ snaŋ kan bjalan-jalan kan rame-rame.	NA	kalo oaŋ snaŋ kan b- jalan ~ jalan kan rame ~ rame	TOP person glad KAN BA- walk ~ walk KAN crowded ~ crowded	others like to go around with friends, right?	NA	NA	22	Mudung Darat	2005-05-26	Jambi	Jambi Province	-1.610415	103.613128	Conversation	NA	Spoken	Natural	Talking about Mrs Salamiah's past. The conversation took place at her house.	0:09:58	259	859	Jambi (city and surrounding villages)	11	Traditional Jambi Malay	NA	13	Primary	1	1	Mudung Darat Malay
2.0684011502315082e+17	3	10040412073739521e7	NA	snaŋ	snaŋ	glad	1628	MDD-260505_b	1214	0:53:15	NA	2660	SILMDD	awaʔ la snaŋ ɲaŋan ɲbʊt kakuraŋan oraŋ.	NA	awaʔ la snaŋ ɲ- jaŋan ɲ- sbʊt ka- kuraŋ -an oraŋ	PRO PFCT glad N- do.not N- mention KA- less -AN person	she has a happy life, she shouldn’t talk about others’ weaknesses.	NA	NA	22	Mudung Darat	2005-05-26	Jambi	Jambi Province	-1.610415	103.613128	Conversation	NA	Spoken	Natural	talking about participants's activities and someone's privacy (gossip) at the front part of Sila's house. it was a hot day. Titin went to her friend's house using a motorcycle.	0:59:58	1378	5915	Jambi (city and surrounding villages)	11	Traditional Jambi Malay	NA	13	Primary	1	1	Mudung Darat Malay
293994024822080900	7	10040412073739521e7	NA	snaŋ	snaŋ	glad	1628	MDD-260505_b	1365	0:59:17	NA	2660	SILMDD	biaʔ cinto biaʔ idaʔ, apo kito snaŋ dŋan oraŋtu apo idaʔ yo?	NA	biaʔ cinto biaʔ idaʔ apo kito snaŋ dŋan oraŋ -tu apo idaʔ yo	although love although NEG what 1PL glad with person -TU what NEG yes	whether we love or not, like the person or not, right?	NA	NA	22	Mudung Darat	2005-05-26	Jambi	Jambi Province	-1.610415	103.613128	Conversation	NA	Spoken	Natural	talking about participants's activities and someone's privacy (gossip) at the front part of Sila's house. it was a hot day. Titin went to her friend's house using a motorcycle.	0:59:58	1378	5915	Jambi (city and surrounding villages)	11	Traditional Jambi Malay	NA	13	Primary	1	1	Mudung Darat Malay
8387604341082019e8	5	10040412073739521e7	NA	snaŋ	snaŋ	glad	1707	TJR-200605_a	210	0:07:26	NA	2405	RHMTJR	ha, 0sampe situ tadikan snaŋ la ati.	NA	ha 0- sampe situ tadi -kan snaŋ la ati	EXCL 0- reach there earlier -KAN glad PFCT liver	we were glad when we reached there.	NA	NA	24	Tanjung Raden	2005-06-20	Jambi	Jambi Province	-1.610415	103.613128	Conversation	NA	Spoken	Natural	talking about past. when the experimenter recorded, it was raining.	1:02:33	1673	7901	Jambi (city and surrounding villages)	11	Traditional Jambi Malay	NA	52	Primary	1	1	Tanjung Raden Malay
8751684698152019e8	4	10040412073739521e7	NA	snaŋ	snaŋ	glad	1707	TJR-200605_a	272	0:09:45	NA	779	EKOTJR	tu bukan main snaŋ nian ati.	NA	tu bukan main snaŋ nian ati	that not play glad very liver	that made very happy.	NA	NA	24	Tanjung Raden	2005-06-20	Jambi	Jambi Province	-1.610415	103.613128	Conversation	NA	Spoken	Natural	talking about past. when the experimenter recorded, it was raining.	1:02:33	1673	7901	Jambi (city and surrounding villages)	11	Traditional Jambi Malay	NA	52	Primary	1	1	Tanjung Raden Malay
5907361695022018e8	2	10040412073739521e7	NA	snaŋ	snaŋ	glad	1707	TJR-200605_a	868	0:31:22	NA	2405	RHMTJR	0ɪdʊp snaŋ.	NA	0- ɪdʊp snaŋ	0- live glad	they were happy.	NA	NA	24	Tanjung Raden	2005-06-20	Jambi	Jambi Province	-1.610415	103.613128	Conversation	NA	Spoken	Natural	talking about past. when the experimenter recorded, it was raining.	1:02:33	1673	7901	Jambi (city and surrounding villages)	11	Traditional Jambi Malay	NA	52	Primary	1	1	Tanjung Raden Malay
3342425206362018e8	6	10040412073739521e7	NA	snaŋ	snaŋ	glad	1707	TJR-200605_a	1194	0:43:30	NA	2405	RHMTJR	tu, ai ko kalu bŋenko snaŋ ɪdʊp, daʔ macam kini susa lʊpe.	NA	tu ai ko kalu bŋen -ko snaŋ ɪdʊp daʔ macam kini susa lʊp -e	that EXCL TRU.Eko TOP old -KO glad live NEG sort now difficult TRU.boy -E	that’s it, well in the past living was nice, not like now. it’s hard, honey.	NA	NA	24	Tanjung Raden	2005-06-20	Jambi	Jambi Province	-1.610415	103.613128	Conversation	NA	Spoken	Natural	talking about past. when the experimenter recorded, it was raining.	1:02:33	1673	7901	Jambi (city and surrounding villages)	11	Traditional Jambi Malay	NA	52	Primary	1	1	Tanjung Raden Malay
4816199144252018e8	1	10040412073739521e7	NA	snaŋ	snaŋ	glad	1707	TJR-200605_a	1195	0:43:34	NA	620	DATTJR	snaŋ.	NA	snaŋ	glad	happy.	NA	NA	24	Tanjung Raden	2005-06-20	Jambi	Jambi Province	-1.610415	103.613128	Conversation	NA	Spoken	Natural	talking about past. when the experimenter recorded, it was raining.	1:02:33	1673	7901	Jambi (city and surrounding villages)	11	Traditional Jambi Malay	NA	52	Primary	1	1	Tanjung Raden Malay
7735892157872018e8	9	10040412073739521e7	NA	snaŋ	snaŋ	glad	1707	TJR-200605_a	1497	0:55:23	NA	2405	RHMTJR	iyo pmudaʔan dioʔkola daʔ.do neŋoʔ tʊjʊ blas agʊstʊstu snaŋ rame-rame edaʔ?	NA	iyo p- muda -an dioʔ -ko -la daʔ.do n- teŋoʔ tʊjʊ blas agʊstʊs -tu snaŋ rame ~ rame edaʔ	yes PA- young -AN 3 -KO -LA NEG.exist N- look seven teen August -TU glad crowded ~ crowded NEG	well, since he was young he never saw the festivity of August seventeen, right?	NA	‘he’ refers to ‘Eko.’	24	Tanjung Raden	2005-06-20	Jambi	Jambi Province	-1.610415	103.613128	Conversation	NA	Spoken	Natural	talking about past. when the experimenter recorded, it was raining.	1:02:33	1673	7901	Jambi (city and surrounding villages)	11	Traditional Jambi Malay	NA	52	Primary	1	1	Tanjung Raden Malay
945148104205210800	3	10040412073739521e7	NA	snaŋ	snaŋ	glad	1697	TJR-170605	486	0:14:45	NA	1766	MARTJR	daʔ, oraŋtu snaŋ.	NA	daʔ oraŋ -tu snaŋ	NEG person -TU glad	no, the man liked him.	NA	NA	24	Tanjung Raden	2005-06-17	Jambi	Jambi Province	-1.610415	103.613128	Conversation	NA	Spoken	Natural	talking about fishing and  Ramzi, a humoristic boy.	0:17:48	617	2531	Jambi (city and surrounding villages)	11	Traditional Jambi Malay	NA	52	Primary	1	1	Tanjung Raden Malay
356965090037240700	7	10040412073739521e7	NA	snaŋ	snaŋ	glad	1697	TJR-170605	593	0:17:18	NA	1766	MARTJR	memaŋ kalu budaʔ kalu nakalko ati snaŋ.	NA	memaŋ kalu budaʔ kalu nakal -ko ati snaŋ	indeed TOP kid TOP naughty -KO liver glad	actually, if the kids are humorist, we will cheer.	NA	NA	24	Tanjung Raden	2005-06-17	Jambi	Jambi Province	-1.610415	103.613128	Conversation	NA	Spoken	Natural	talking about fishing and  Ramzi, a humoristic boy.	0:17:48	617	2531	Jambi (city and surrounding villages)	11	Traditional Jambi Malay	NA	52	Primary	1	1	Tanjung Raden Malay
